{
  "novelId": "global-descent",
  "chapterNo": 513,
  "sourceLang": "cn",
  "targetLang": "cn",
  "title": {
    "source": "第513章",
    "translated": "ตอนที่ 513"
  },
  "status": "source",
  "paragraphs": [
    "大規模招募，兌換女祭司捲軸。（5200）",
    "看著迷霧中的生物，曹星心中不由得出現了一股心悸感。",
    "「是雪地里的野獸嗎？還是什麼？」",
    "他本能的感覺到有些不對勁，於是說道：「伊莎貝爾，停止釋放光明氣息吧。」",
    "話落，這個女人便中斷了光芒的釋放。",
    "與此同時，周圍的視線再次被厚重的濃霧遮蔽，曹星心中的那股心悸感也隨之消失。",
    "他依舊停留在高空中，目光看向四周，掃視著領地周邊的情況。",
    "在觀察了幾分鐘，確認沒什麼異常後便直接說道：",
    "說完，便帶著伊莎貝爾，向著腳下的區域筆直墜落。",
    "如同穿過厚重的雲層，他們一直下降了三四千米，才隱隱約約看到領地中出來的亮光。",
    "順著亮光的方向，二人很快便穩穩落地。",
    "與此同時，在領地燈塔的指引下，霄他們也已經返回了領地。",
    "看到曹星之後，霄恭敬的走過來道：「多謝領主大人的指引。」",
    "曹星沒有說話，而是將目光看向場上的眾人。",
    "發現確實沒有少人之後，才微微點頭。",
    "霄繼續道：「領主大人，這是我們這段時間清繳那些冰巢怪獲得的戰利品，請您過目。」",
    "說完，他就遞過來一個綠色品質的背包。",
    "曹星接過後，看了一眼裡面的東西，臉上再次浮現出了笑容。",
    "【獲得：五階龍血鬥士招募捲軸*23】",
    "【獲得：五階精英龍血鬥士招募捲軸*4】",
    "【獲得：冰龍印記*72萬】",
    "【獲得：冰川裂片*44萬】",
    "【獲得：龍巖礦（金）*4598】",
    "【獲得：中型抗腐敗藥劑*22】",
    "在神諭之戰後，系統推出了加強版冰巢，裡面的怪物等級得到了巨大的提升。",
    "同時，還有小概率爆出來龍血鬥士招募捲軸。",
    "雖然概率很小，但近半個月的征戰下來，霄那邊也是獲得了足足二十多張！",
    "而且，這還只是其中的一部分。",
    "因為曹星是將領地中的人分成了兩波，伯捷統帥同樣帶了一支軍團在對付加強版冰巢怪。",
    "所以，他那邊估計也有不少招募捲軸。",
    "「很好，看來今天就可以湊齊一個百人的龍血鬥士軍團了！」",
    "然後，他從背包中取出了【無名劍聖手冊（橙）】，然後遞了過去。",
    "「這是什麼？」霄接過之後，疑惑的問道。",
    "隨著裡面記錄的內容呈現，霄的眼神瞬間凝重了起來。",
    "甚至於，到後面已經出現了一股難言的震撼！",
    "他驚呼道：「難以想像，這居然是一位傳奇劍聖留下來的手冊，上面記錄了他的畢生心血！」",
    "「甚至於連傳奇級戰技都記錄在上面！」",
    "此言一出，不光光是霄，他背後的星之國劍士們同樣感到十分震撼。",
    "曹星問道：「霄，你有信心學會上面的能力嗎？」",
    "這名劍士頓時神色一正，然後點頭道：「可以，尊敬的領主大人！」",
    "「這本手冊上面記載的各種劍術非常適合我，光是粗略看了幾眼，就讓我有了不少的感觸。」",
    "「如果能夠長期練習，可以在短時間內讓我的劍術迎來飛躍，打破大師級的桎梏，蛻變到英雄級！」",
    "曹星眼中出現讚賞之色。",
    "果然，像霄這種會自創劍術的，一般都是劍之一道的天才。",
    "「很好，那這本手冊就先交給你，努力學習吧。」",
    "「遵命！我必定不會辜負領主大人的期望，爭取早日領悟上面的劍術！」",
    "他如獲至寶般，將這本手冊小心翼翼的收進了背包中。",
    "包括其他劍士們，也一臉羨慕的看著他。",
    "同為劍士，他們清楚的知道，這本手冊有多麼珍貴。",
    "畢竟，那可是一個劍聖的感悟啊，甚至還有傳說中的傳奇戰技，說是傳奇劍聖的親自教導都不為過。",
    "這種東西，在大陸上可是會引起一些強者爭搶的！",
    "曹星繼續道：「好了，都各自去食堂吃飯吧，一會我還會找你們。」",
    "包括霄也帶著激動的心情，迅速前往了訓練場，準備練習上面的劍術去了。",
    "看著他的背影，曹星又掃了一眼背包中剩下的10顆【劍語石】。",
    "他沒有將這種石頭給霄，原因有很多。",
    "一是因為這玩意太稀少了。",
    "而且，說不定接下來他會遇到比霄更強的劍士。",
    "到時候將這10顆劍語石賜予他，如此才能收益最大化。",
    "霄雖然足夠強，但還不是曹星心中的最佳人選。",
    "當然，如果他真的天賦異稟，能夠在短時間內學會這名劍聖的技能，那麼曹星才會考慮，將這種珍貴的資源用在他身上。",
    "此刻，曹星看著背包中一大堆捲軸，臉上也浮現出一抹笑意。",
    "「很好，這半個月來，他們在領地附近戰鬥也給我帶來了不少收益。」",
    "「不過，幹掉這些加強版冰巢，除了這些招募捲軸和材料之外，可還有黃金積分獎勵！」",
    "「這也是一項極其珍貴的資源，畢竟黃金積分商店中，還有很多好東西沒有兌換呢。」",
    "在神諭之戰結束後，他將黃金積分差不多花得只剩下最後28點。",
    "然後發展期第一周，伯捷和霄，一共為他獲得了460的黃金積分。",
    "再加上怪物攻城通關第七波和排行榜獎勵，給了200黃金積分。",
    "就是不知道，他離去的這六天時間，伯捷和霄又給自己獲得了多少積分？",
    "帶著期待的心情，查看了一眼。",
    "【黃金積分*1128】",
    "曹星嘴角出現了一抹笑容。",
    "「黃金積分破一千了，這波有點舒坦啊……」",
    "他可是惦記著黃金積分商店中，那一張女祭司法娜茲的招募捲軸很久了。",
    "整個商店中，除了那一張主宰級的招募捲軸之外，就屬她最貴了，足足1000黃金積分！",
    "如今，也是終於湊夠了。",
    "於是他毫不猶豫的點擊了兌換！",
    "【是否消耗黃金積分*1000，兌換四階女祭司法娜茲招募捲軸*1？】",
    "黃金積分，再次被消耗得只剩下128點。",
    "而曹星背包中也多出了一張橙色的捲軸。",
    "說起來，現在他的背包中有很多招募捲軸都需要召喚。",
    "除了女祭司和龍血鬥士捲軸，還有幾十張流浪劍客的。",
    "正當曹星準備召喚的時候。",
    "一道身著青色法袍的身影，步伐輕快的走了過來。",
    "此人正是領地里的風系大法師，艾倫，目前也已經擁有了67級的實力。",
    "「艾倫，有什麼事嗎？」曹星回道。",
    "「尊敬的領主大人，我是來向您匯報我最近的修行進度的。」",
    "「您上次交給我的那本手冊上記錄了諸多風系法術，經過這段時間的修行，目前我已經學會了兩個新的法術。」",
    "「分別是『風神之佑』和『風之信標』。」",
    "曹星眼中出現讚嘆之色。",
    "他領悟的這兩個技能都十分強大，對領地很有幫助。",
    "風之信標可以標記敵人的位置，最遠距離能達到幾千公里。",
    "而【風神之佑】更是變態，不僅能夠附加一個高耐久的護盾，護盾碎裂後還能對敵人造成近兩倍的爆破傷害！",
    "不過，當初曹星是通過【法術捲軸】釋放的這兩種技能。",
    "就是不知道經過這些大法師釋放後，會有什麼變化？",
    "曹星掃了一眼艾倫面板上，那兩個新技能。",
    "【風神之佑：凝聚風之元素，為友方單位附加一層281242耐久值的護盾（魔法攻擊力+（精神*50），護盾碎裂後，對周圍敵人造成自身攻擊力*188%的碎裂傷害，冷卻時間：100秒】",
    "【風之信標：凝聚風之元素，對目標附加一層標記，可模糊感應到對方位置，最大距離為：3500公里，冷卻時間：5分鐘】",
    "「龜龜……居然一下子提升這麼多嗎？」",
    "要知道，之前在那張魔法捲軸上，僅僅只能附加固定兩萬點耐久值的護盾。",
    "而現在，根據艾倫的屬性，能夠直接獲得一個近二十八萬耐久值的護盾！",
    "這是什麼概念可想而知。",
    "而且，曹星領地中還不止這一個能夠附加護盾的狀態。",
    "「除了艾倫之外，沃利也有一個天聲震落技能，能夠給全員附加10%基礎生命值的護盾。」",
    "「而沃利現在已經是70級的首領級生物，不算上蒼白之樹的加成，生命值已經到了390萬！」",
    "「然後還有法蘭茜絲卡的『森林賜福』技能，能夠給友方附加20%生命上限的護盾。」",
    "「換句話說，這三個護盾狀態加起來，相當於差不多一百萬的生命上限！」",
    "在得出這個數字後，曹星更是喜不自勝。",
    "畢竟，這不是單個的一百萬，而是整個領地所有人都能獲得這種加成。",
    "就連那些工作人員也能擁有這種堪稱變態的護盾效果。",
    "現在極地人們的等級差不多都在20級左右，經過一系列狀態加成，甚至能夠單挑六階精英級生物了。",
    "相當于越了幾十級去戰鬥，這是什麼概念可想而知。",
    "「好好好，我的炸盾流指日可待啊！」曹星忍不住驚喜的說道。",
    "當然，除了【風神之佑】，另外一個技能——【風之信標】，也有了些許變化。",
    "之前是固定的3000公里，現在最大標記範圍已經到了3500公里。",
    "對於艾倫的表現，曹星十分滿意。",
    "「你做得很好，艾倫，後面繼續努力學習上面的法術。」",
    "「爭取早點將『風翼』，還有禁咒技能學會。」",
    "艾倫頓時恭敬道：「是，我一定不會辜負領主大人的期望。」",
    "曹星讓他先在一旁等待，等一會給所有人刷新一遍狀態，並且附加風神之佑這個能力。",
    "然後，又讓伯捷來領地中找他。",
    "一道瘦小的身影快步走了過來。",
    "他提著手裡的巨斧，輕彎下腰，彬彬有禮的說道：「領主大人，夜安。」",
    "伯捷在平時的時候，顯得很紳士，和戰鬥時那種狂野的畫風完全不一樣。",
    "曹星直接說道，「伯捷統帥，先將近期對付那些冰巢怪，獲取的戰利品給我吧。」",
    "伯捷聽罷也迅速從腰間取出來一個小背包，裡面裝著他這半個月以來的收穫。",
    "「都在這裡了，請您過目。」",
    "曹星接過後迅速掃了一眼，臉上再次浮現出了一抹笑容。",
    "然後便將裡面的東西全部轉移到了【龍紋包】中。",
    "【獲得：五階龍血鬥士招募捲軸*31】",
    "【獲得：五階精英龍血鬥士招募捲軸*5】",
    "算上霄那裡的27張，加起來一共有63張龍血鬥士招募捲軸。",
    "而他的領地中，本身就有54名龍血鬥士。",
    "這下子，湊出個百人龍血鬥士軍團，已經完全足夠了。",
    "曹星心滿意足的點了點頭。",
    "然後將所有龍血鬥士捲軸取了出來，統一點擊了召喚。",
    "這也是他有史以來，一次性召喚龍血鬥士最多的一次。",
    "一顆顆封印著龍血鬥士的冰塊，劃破覆蓋迷霧的天空，落在了曹星面前。",
    "一個個龍血鬥士擊碎冰塊，從封印中走去。",
    "作為戰鬥名族，他們每個人身上都散發著強大的戰意。",
    "「諾恩一族，第十三軍團，奧吉恩/斯科恩/恩特……向您報導！」",
    "話落，旁的伯捷上前一步，率先說道：「我是獵龍軍團統帥，伯捷·逐日者。」",
    "「昔日的族人，我將帶領你們，再次並肩作戰！」",
    "場上，一眾龍血鬥士紛紛將目光投在了他的身上，眼中浮現驚訝之色。",
    "「是伯捷統帥，那位傳說中的諾恩！」",
    "「沒想到，我們還能有幸在您的帶領下戰鬥。」",
    "「伯捷統帥，我們將完全服從於您！」",
    "而此刻的伯捷卻搖頭道：「你們不必完全服從於我，而是要完全服從於領主大人。」",
    "「他是這個領地的主人，旗下擁有一眾大師級強者，你們所有人都不得造次。」",
    "龍血鬥士們紛紛將目光看向曹星。",
    "在感受到他身上那股浩瀚的魔力後，頓時出現讚嘆與欽佩之色。",
    "諾恩一族崇尚力量與強者。",
    "很顯然，曹星現在擁有的力量，已經將他們折服。",
    "這些新加入的龍血鬥士恭敬道：",
    "「見過這位強大的領主，我們將為您貢獻出自己的力量。」",
    "曹星微微點頭：「歡迎你們的加入，強大的諾恩一族。」",
    "然後，便讓他們先在一旁等待。",
    "而曹星則是掃了眼其中幾人的面板。",
    "這些龍血鬥士，在達到一百人後，同樣激活了一個軍團技能。",
    "【軍團技能·龍翼：凝聚體內的龍血之力，在背後生長出一對龍翼，使自身機動能力增加30%，並且獲得低空作戰的能力。】",
    "「還不錯，這個軍團技能讓龍血鬥士們更靈活了，可以適應各種戰場。」",
    "「而且等後面艾倫學會風翼，他們也相當於擁有了兩對翅膀。」",
    "在召喚完龍血鬥士後，接下來使用另外一種招募捲軸了。",
    "【是否使用六、七階流浪劍客招募捲軸*46？】",
    "【是否使用六、七階精英流浪劍客招募捲軸*8？】",
    "【是否使用六階首領級流浪劍客招募捲軸*2？】",
    "瞬間，背包中共計56張捲軸全部消失。",
    "然後化作一柄柄長劍飛翔在半空。",
    "這些長劍如同具有靈性一般，在半空中不斷舞動，吸引了場上不少人的目光。",
    "然後，落在地上化作一道道人影。",
    "「流浪劍客：佐客/佐菲/凱利……向您報導。」",
    "這群流浪劍客此刻都是差不多的打扮。",
    "身著一襲破舊而又不失風格的皮質風衣，皮質歷經歲月洗禮，泛著古銅色的光澤。",
    "頭上戴著一頂寬邊氈帽，陰影遮住大半張臉，只露出一雙雙銳利如鷹的眼睛。",
    "腰間掛著一把古樸厚重的長劍，他們即使站在原地，都保持著隨時出劍的姿勢。",
    "其中，當屬那兩名首領級的流浪劍客氣勢最為強大。",
    "曹星例行公事的說了一遍：「歡迎你們的加入，流浪的劍士們。」",
    "而這些新招募出來的流浪劍客也迅速觀察了一番這個領地。",
    "在看到那一座座豪華的建築時眼中不禁出現了讚嘆之色。",
    "「這位強大的領主，您有著一座繁華的領地。」",
    "「還有您自身的實力，也如同冰川般浩瀚，我們將為您而戰。」",
    "自從曹星現在的實力提升上去後，可以說是少了很多的麻煩。",
    "七階大法師，擁有堪稱強大的實力，而只有足夠強大的實力，才會贏得這些人的敬重。",
    "曹星笑了笑，「你們也先在原地稍等片刻，一會我會給你們安排住所。」",
    "所有劍士們聽話的走到一邊，默默等待。",
    "而曹星則是看了眼他們的屬性。",
    "當然，看的是那兩名首領級流浪劍客的屬性。",
    "【等級：56（六階首領生物）】",
    "【生命值：1885263/1885263（蒼白之樹賜福）】",
    "【攻擊力：8735~8981（統御術）】",
    "【護甲：2124~2178】",
    "【技能：專家級劍術精通，落鳳斬，斷水流，流風斬，御劍出鞘！】",
    "【羈絆-流浪劍客軍團：10人、20人、50人……攻擊力+20、攻擊速度+20%，技能冷卻時間-20%",
    "100人時，額外激活技能：浪客劍心】",
    "在前面劍冢中挑戰的時候，曹星就體會過這些劍士的戰鬥方式。",
    "每個人都有著不錯的劍術天賦，傷害也不低。",
    "當然，爆發傷害最高的，是他們首領級技能——【御劍出鞘】。",
    "這群流浪劍客中剛一召喚出來，就擁有兩名首領，外加全員最低六階的戰力。",
    "可以說，他們現在是除了那些核心戰鬥人員之外，等級最高的兵種了。",
    "然後，又從背包中取出來最後一張招募捲軸，點擊了使用。",
    "【是否使用女祭司法娜茲的招募捲軸？】"
  ],
  "updatedAt": "2026-06-25T04:03:59.000Z"
}