{
  "novelId": "global-descent",
  "chapterNo": 1085,
  "sourceLang": "cn",
  "targetLang": "cn",
  "title": {
    "source": "第1085章 暴富52億冰龍印記",
    "translated": "ตอนที่ 1085"
  },
  "status": "source",
  "paragraphs": [
    "全球降臨：帶著嫂嫂末世種田第1085章",
    "暴富52億冰龍印記,一條小白蛇",
    "全球降臨：帶著嫂嫂末世種田",
    "全球降臨：帶著嫂嫂末世種田",
    "全球降臨：帶著嫂嫂末世種田",
    "獲得：冰龍印記2013萬",
    "獲得：冰川裂片1147萬",
    "獲得：寒地符文石（未知）28枚",
    "獲得：冰川內核（橙）264812",
    "獲得：龍巖礦（金）52516",
    "獲得：中級屬性之書……",
    "只要這一次，證據確鑿的情況下，穆青峰恐怕就要在牢房里呆一輩子了。",
    "老人家的意思我都明白，所謂病急才會亂投醫，她這是著急讓老爺子開口，才愿意信我，試試我的法子。",
    "哪怕全世界都背離了她，只要有亓灝在身邊，她就覺得一切都是無所謂了。",
    "張曉芳自然以為他是要對姬睿說什么不好的話，畢竟姬睿乃是異瞳，被大魏人視為不祥之兆。",
    "老嫗顯然沒想到，這突入起來的音波，竟然能量滾滾，將她都震得頭暈不止，耳膜都震破了。",
    "孟芷蕾臉上帶著青春甜蜜的笑，正與孟夫人說著什么，孟夫人看向對面的面容突地有些嚴肅，眸光透出一絲冷厲來。",
    "蘇可看著老人，他臉上帶著淡淡的笑意看著她，蘇可的心里隱約覺得，這一切都和他們脫不了關系。",
    "如果葛天秀吸入毒氣，恐怕不好辦，楚凡毫不猶豫，連連打出印結。",
    "葛天秀吐了吐舌頭，伸了伸懶腰，就跑到一堆干草上面，躺了下來。",
    "方步恨不得殺光所有天狼帝國的士兵，畢竟，就是因為天狼帝國的入侵，讓方步失去了不少的兄弟。那些同生共死的兄弟，比起親兄弟還要親的兄弟，一個個離他而去，那一眾痛苦，并不是普通人可以承受的。",
    "被偷襲的一方，有了帶頭大哥上去搗亂的時間，后面的人紛紛準備期了魔法，一個個的攻擊魔法不斷的向著敵人砸去。",
    "說實話，我心里有那么一點感動，決定以后救他一次作為回報好了。其實那殺氣不是沖我來的，倒像是沖王玉去的。",
    "德懷特的眼神掙扎了一下。涉及到自己的生命的時候，精神控制的效果便會大打折扣。",
    "刷！他臉黑了，眼睛黝黑無比的盯過來，甚至不包含任何感情。云茉雨手心見汗，不愿妥協的微微搖著頭，但是肖曠不動搖，依然保持之前要打開的動作。",
    "尤其是孫安哲也是跟著爸爸買過菜的，回想起了爸爸是如何買菜。",
    "“但是我怎么沒有看到你的金幣呢？你該不會是騙我們這些可憐的人吧？”那聲音再次問道。",
    "這次，妖王只是邪魅著笑，看著劍泉，沒有再說任何的言語，眼里只有玩味和殺機，是生是死，似乎只要他一個念想。",
    "“那樣的，見一個打一回，”高婷婷心里有氣，說著說著上手按了好幾下喇叭，胸口上下起伏。",
    "“承諾？你的承諾可不值錢，昨晚還答應我說好吃好喝好招待，結果今天哩，食言了不是！”君梓羽冷嘲熱諷地說著。",
    "只不過，現在最缺的就是時間，他們能夠掉到兩千弟子，已經算是萬幸。",
    "但是，安熙兒口中說的“瑾”，正是何尊在幾年前的游戲里認識的最好的朋友，她消失了那么久，若能在安熙兒口中得知她的消息，要加入帝王工會也未嘗不可。",
    "可是這時，雷山發現不對勁了，因為雷山發現自己的房間此時竟然變的如同一座平臺一樣，孤零零的立在那里，看起來甚是悲涼。",
    "全球降臨：帶著嫂嫂末世種田目錄",
    "全球降臨：帶著嫂嫂末世種田",
    "hjwzw@live.com"
  ],
  "updatedAt": "2026-06-25T04:03:59.000Z"
}