{
  "novelId": "global-descent",
  "chapterNo": 91,
  "sourceLang": "cn",
  "targetLang": "cn",
  "title": {
    "source": "第91章"
  },
  "status": "source",
  "paragraphs": [
    "第91章 分解兔子屍體，大量收穫",
    "曹星心中充滿了期待，不過現在最重要的，還是處理眼下的戰鬥。",
    "投彈兔的陣型已經崩潰，它們在到處亂躥，試圖逃離這裡。",
    "而曹星可是等著補充一波食物呢，怎麼可能讓它們輕易逃跑。",
    "「蕾妮絲，莎拉，給我攔下它們！」",
    "「阿薩姆，安德魯，幹掉地上的投彈兔。」",
    "隨著曹星的下令，招募生物們開始展現更加凌厲的攻勢！",
    "咻！咻咻！",
    "一隻只逃跑的投彈兔被蕾妮絲當場命中。",
    "而布洛特·硫磺石此時也掀起了一場黑煙風暴，擊殺了成片的投彈兔。",
    "「啾啾！啾啾啾！」",
    "冰球投彈兔們此時再也沒有了之前的囂張和匪氣，一個個到處試圖尋找躲藏的地方。",
    "它們甚至想鑽進地面的老鼠洞裡，然而因為太肥了，大半個屁股露在外面。",
    "看到這一幕，曹星嘴角不僅翹起了一抹弧度。",
    "然後，他直接凝聚幾根冰錐，瞬間激射過去。",
    "幾分鐘後，戰鬥結束。",
    "冰球投彈兔被擊殺了大半，其他兔子僥倖逃走了一部分。",
    "因為大白那龐大的身軀，開啟【狂暴衝鋒】後，撞斷了許多棵銀杉樹。",
    "再加上曹星的【冰箭雨】和布洛特的【黑煙風暴】，都是群攻傷害。",
    "這片樹林中出現了一片狼藉的景象。",
    "曹星注意到，那些斷裂的樹枝上還有一些鳥窩。",
    "他走了過去，將鳥窩裡的東西都收了起來。",
    "【獲得鳥蛋*6】",
    "【獲得羽毛*37】",
    "【獲得鳥蛋*6】",
    "【獲得羽毛*37】",
    "…",
    "柳慕雪也在旁邊跟著收集，然後好奇的問道：「阿星，這些羽毛收集起來有用嗎？」",
    "「當然有用。」",
    "曹星轉過身回道：「做箭矢要用到羽毛，以後我們訓練出來的民兵，需要製作很多箭矢，而這些箭矢就要消耗很多材料，所以能省一點省一點。」",
    "「原來如此。」",
    "柳慕雪眼中出現恍然之色。",
    "然後，她也跟著更加賣力的收集了起來。",
    "將地上的鳥蛋和羽毛全部收起。",
    "累計獲得：",
    "【蛋*72枚】",
    "【羽毛*342根】",
    "然後，就是這些投彈兔的屍體了。",
    "曹星靠近後，系統提示出現。",
    "【冰球投彈兔的屍體（可分解）】",
    "曹星直接點擊了分解。",
    "那隻肥碩的兔子屍體上，出現了一陣白光。",
    "然後原地出現了一張兔皮，一堆新鮮的兔肉，還有兩顆藍色的石頭。",
    "曹星看了一眼，這些東西的屬性。",
    "【磨損的冰雪投彈兔皮（白）*1】",
    "（雖略有磨損，但厚實的毛髮具有不錯的保暖性，可以製作成防寒衣物，也可以在城鎮中出手，能賣到不錯的價格。）",
    "【投彈兔肉（綠）*16】",
    "（蘊含著微弱魔法波動的兔肉，1塊兔肉=5食物，初次服用，可增加1點敏捷屬性。）",
    "【堅硬的兔牙（綠）*2】",
    "（堅硬的兔牙，磨尖後可用來製作成槍頭，或是賣給城中的商人。）",
    "【冰晶石（綠）*1】",
    "…",
    "「咦，綠色品級的兔肉，這不錯啊！」",
    "一隻冰雪投彈兔可以提供十幾塊兔肉，也就是差不多十幾公斤。",
    "雖然沒辦法像雪地暴熊肉那樣，賣出很高的價格，但是奈何他們殺的兔子數量多啊！",
    "剛剛，他們至少幹掉了近兩百隻兔子，全部分解，能夠收穫到大量的兔肉和兔皮！",
    "曹星眼中帶著欣喜的神色。",
    "「慕雪，開始分解兔子咯。」",
    "柳慕雪臉上也帶著收穫的喜悅，激動的點頭，「嗯嗯！」",
    "這一波下去，收穫的食物又足夠領地居民們撐上半個月。",
    "【成功分解冰球投彈兔屍體……】",
    "【成功分解冰霜投彈兔屍體……】",
    "【成功分解……】",
    "系統提示不斷出現。",
    "柳慕雪將剛剛收穫的資源全部交易給了曹星，節省背包空間。",
    "曹星統計了下收穫，累計獲得：",
    "【磨損的冰球投彈兔皮（白）*154】",
    "【磨損的冰霜投彈兔皮（綠）*5】",
    "沒辦法，剛剛兔子太多了，一片混戰，所以幾乎沒有一張完整的兔皮。",
    "除此之外，還獲得了一些兔肉和兔牙。",
    "【冰球投彈兔肉（綠）*2310】",
    "【冰霜投彈兔肉（藍）*112】",
    "（精英級投彈兔身上的肉，肉質鮮嫩，初次服用，可增加精神2點，體質2點。）",
    "【堅硬的兔牙（綠）*297】",
    "【冰晶石（綠）*75】",
    "【初級元素結晶*24】",
    "…",
    "收穫可以說是頗豐。",
    "最關鍵的是，在那幾隻精英級別的兔子身上，還爆出了不少藍色的兔肉。",
    "這玩意的價格，可以說幾乎跟暴熊肉不相上下！",
    "曹星心裡一喜。",
    "因為這樣一來，他就又有新的東西能夠去跟其他倖存者交易了！",
    "而且，現在資源充足了，庫存的【雪地暴熊肉】也可以全部拿出來交易。",
    "領民們的日常吃的東西，可以用其他食物代替，爭取利益最大化。",
    "想到這裡，曹星滿意的點了點頭。",
    "在確定周圍沒有什麼遺漏的東西之後。",
    "他宣布道：「繼續下山！」",
    "咚！咚咚！",
    "大白邁開步子，沿著這條山路前進。",
    "接下來，沒有再遇到什麼意外。",
    "他們很快就來到了山腳下，然後徑直離開伯瑞利斯山脈。",
    "茫茫的雪原中，留下他們這群人不同的腳印。",
    "曹星看了眼頭頂的時間。",
    "【距離夜幕降臨：2小時17分……】",
    "【當前溫度：-57℃】",
    "「還有兩個多小時，完全夠我回領地了。」",
    "隊伍沿著另外一條路線，朝著營地方向前進。",
    "而莎拉還是照例消失在陰影中，在前方探路。",
    "自從進階為三階首領級存在，莎拉的移動速度快得可怕，哪怕是在雪地中，也完全無法拖延這個暗精靈的行動能力。",
    "在前進了大概五公里後。",
    "莎拉再次無聲無息的出現在曹星身邊，並且匯報導：「尊敬的領主大人，前方發現了一座村莊。」",
    "「村莊？」",
    "聽到這話，曹星眼中帶著些許疑惑。",
    "他打開地圖看了一眼。",
    "在他所在的位置，西北方向大概一公里遠左右。",
    "有著一個村落，叫做【霍格村】。",
    "順著地圖的方向眺望，能夠隱隱看到一片被白雪覆蓋的低矮建築。",
    "隔著這麼遠都能看到這些建築，就說明這是個規模不小的村鎮。",
    "曹星思索道：「有村莊的話，應該也有雜貨鋪，糧食鋪之類的商店吧？」",
    "「我是不是可以把手中的雜物處理一下，然後找這些原住民換點其他資源過來？」",
    "想到這裡，曹星打定了主意。",
    "「走，過去看看。」",
    "曹星帶著隊伍，浩浩蕩蕩朝著【霍格村】接近。",
    "靠近過後，眾人發現這座村子的規模真的挺大。",
    "大大小小至少幾百間房屋，都快比得上一個鎮子的面積了。",
    "一條凍成冰面的河流，順著村子邊緣穿過。",
    "而在旁邊，還有開墾過的方塊農田，農田上面蓋著大棚，用來抵禦風雪。",
    "不僅如此，曹星還在村莊附近看到了許多羊圈，牛棚。",
    "裡面圈養著一群毛髮旺盛的綿羊和牛群！",
    "「好多牛羊啊！」曹星兩眼發光。",
    "這要是全部宰了，得分解成多少牛肉羊肉？",
    "柳慕雪輕聲道：「阿星，那些好像是氂牛，可以產奶的。」",
    "聽到這話，曹星更加激動了起來。",
    "牛奶是好東西，不僅能夠恢復血量，還能增加飽食度。",
    "曹星打定了主意，如果可以的話，看看能不能向這群原住民，買幾頭奶牛回去，自己養著。",
    "「走，我們去這個村子裡看看。」",
    "咚！咚咚！",
    "一行人向著村莊前進著，聲勢浩大。",
    "靠近後曹星發現，除了這些農牧業發展。",
    "【霍格村】的防衛力量也還不錯。",
    "村莊周邊，每隔兩三百米，就有一座幾十米高的【哨塔】，上面站著兩個弓箭手，銳利的目光不斷在周圍巡視著。",
    "只不過，【霍格村】最近似乎遇到了一些意外。",
    "村莊外圍似乎有幾塊區域被什麼東西砸中了，房屋成片的倒塌。",
    "一群村民正在駕著梯子，拿著榔頭加急維修中。",
    "地上還有一些殘留下來的血跡，看得出來，這裡前不久應該發生過一些戰鬥。",
    "看著地上的冰塊碎屑，曹星似乎明白了什麼。",
    "一群手持武器的民兵從村子裡迅速沖了出來。",
    "他們遠遠的就注意到了，從雪地中走來的曹星一行人。",
    "不過，曹星這個隊伍的搭配，想不引人注意都難。",
    "三台三米高的機器，旁邊還跟著一頭近五米高的猛獁象。",
    "然後還有半人馬一族，夏爾族，這些都是在狂風雪原很難看到的生物。",
    "咚！咚咚！",
    "猛獁象每一步踏出，都發出強烈的震動，甚至讓村莊附近的幾座房屋，屋檐上的積雪都被震塌了下來。",
    "那群民兵靠近後，頓時驚呼道：「諸神在上，我看到了什麼？那好像是猛獁象！」",
    "「天啊，神聖的猛獁象怎麼會來我們霍格村？」",
    "一群民兵眼中帶著震撼，還有警惕的神色看向曹星等人。",
    "曹星瞥了一眼這群民兵的屬性。",
    "【霍格村民兵：阿爾諾lv10】",
    "【所屬勢力：冰晶王國】",
    "【等階：一階普通民兵】",
    "【生命值：940】",
    "【攻擊力：114~117】",
    "【護甲：16~19】",
    "【技能：基礎劍法（在兵營中經過訓練，學會的基礎劍法）",
    "十字斬（向前方快速發出兩道斬擊，對敵人造成兩段攻擊力*66%的傷害）】",
    "【當前狀態：中立】",
    "……",
    "(本章完)"
  ],
  "updatedAt": "2026-06-23T00:00:00.000Z"
}