{
  "novelId": "global-descent",
  "chapterNo": 1010,
  "sourceLang": "cn",
  "targetLang": "cn",
  "title": {
    "source": "第1010章 準神器,副團長們的禮物。",
    "translated": "ตอนที่ 1010"
  },
  "status": "source",
  "paragraphs": [
    "全球降臨：帶著嫂嫂末世種田第1010章",
    "準神器,副團長們的禮物。,一條小白蛇",
    "全球降臨：帶著嫂嫂末世種田",
    "準神器,副團長們的禮物。",
    "準神器,副團長們的禮物。",
    "全球降臨：帶著嫂嫂末世種田",
    "全球降臨：帶著嫂嫂末世種田",
    "準神器,副團長們的禮物。",
    "當這塊神級娜迦身體碎片出現的瞬間，一股滔天的威壓席卷整個鍛造所！",
    "這股威能遠遠超過了剛剛的血鯨皮革，和那顆血鯨之心！",
    "鍛造所內所有的金屬器具開始劇烈震顫，龍炎熔爐的火焰瞬間變成了詭異的藍紫色。",
    "幾個靠得近的鐵匠學徒甚至直接暈倒在地，就連旁邊的大師級鐵匠都不",
    "她們猜測這里曾經也遭遇過南方省那樣的地陷，只不過南方城是塌陷出了一個原始森林，這里則是塌陷出了一片汪洋大海。南方省沒有全塌，有地方保留了下來，這里，同樣是這樣，有地方保留下來變成島嶼。",
    "“沒錯，你要是之前參加，未必不能得第一名！”孫老也附和道。",
    "剛入職就請假，一定給領導留不住什么多印象。剛要說什么就看到了霍思軒已經生氣的黑臉。",
    "江苗兒震驚了許久，直到現在才堪堪回過神來，只是她說話的語氣，依舊是顯得激動難平，眼中滿是驚愕和不敢置信，萬萬沒有想到，自己竟親眼見證了一個少年人，在自己面前突破元嬰境。",
    "皇室滅了，秦國自然也就不存在了，到時候楚國大軍長驅直入，便可以秦國為基地跟大周軍隊開戰，絲毫不用擔心會傷及到楚國子民。",
    "樓鵬飛吐吐舌頭，想要表決心，又覺得自己說不出口。不說點兒什么，又怕影響在司面前的印象。畢竟回真心話大冒險，主要起哄的人是他。",
    "“好吃，不愧是野生中華鱘，很鮮，這是我這輩子吃過的最好吃的魚了！”靜荷贊不絕口。",
    "“你們竟然……藥膏不在我身上，我可以讓人送來，但是如果藥膏拿來了，你們不放了我外公怎么辦？”沈若蘭咬牙問道。",
    "那段時間，每次隨著前輩去手術室，整個手術期間，都感覺前輩再說葷段子，久而久之，她竟也習慣了，人體對她來說，真的沒有那么不堪入目，沒什么好害羞的。",
    "舉辦公司：淘寶科技、征途科技、支付寶公司、菜鳥物流聯合籌辦。",
    "割草的事情交給弗蘭克準沒錯，他閉著眼睛也能把牧草收割地整整齊齊。",
    "一改剛才那種沉穩，老鬼像是個瘋子一樣，舉著噴槍便開始燒烤，眼底有種叫做瘋狂的情緒突然爆開。",
    "最關鍵的是，如果他的判斷沒錯，這條路、也就是靈氣流動的盡頭，一定也有個傳送法陣等在那里，那是他唯一的活路了。",
    "也許，我們不能在一起，但有你這句話，我們能呆的時間更長一些吧？",
    "志摩老弟面對一舟之上的劍橋博士、國會議員、名門子弟，原來那份驕傲勁兒都煙消云散了。",
    "“可是……”碧霄瞟了一眼那仲昊，她是來尋他的，想著要還他因果。",
    "白起臂上兩尾白龍，亦是吸收大量煞氣，似這等異物，皆是巫族自幼便就養在身邊的巫獸，堪稱分身的存在，如今那白龍俱是化作玄色紋路，烙印在了白起手臂之上，更添其幾分兇勢。",
    "駱云透過下方不算明澈的水面，隱隱能看到石柱下方支撐處也有陣紋一樣的東西。可想而知，這兩側的九根石柱一定也是按照某種規律所排列。",
    "駱云對季流海的秉性了解得很，這是個極懂得權衡利弊的人，而今藥都吞進肚子才說這番話，反正別人信不信不知道，他是不信的。",
    "殊不知，沈云因為那次陰寒毒變異，天極萬象功跟陰寒毒已經完全融合了，不需要在吸收九極真氣了。",
    "全球降臨：帶著嫂嫂末世種田目錄",
    "全球降臨：帶著嫂嫂末世種田",
    "hjwzw@live.com"
  ],
  "updatedAt": "2026-06-25T04:03:59.000Z"
}