{
  "novelId": "global-descent",
  "chapterNo": 145,
  "sourceLang": "cn",
  "targetLang": "cn",
  "title": {
    "source": "第145章"
  },
  "status": "source",
  "paragraphs": [
    "第145章 正式期第一晚，生存難度提升",
    "曹星看了眼圖紙的屬性。",
    "【魔能蓄水裝置圖紙】",
    "【圖紙介紹：可在室內，建造出一台自動淨化水質，具有自動加熱，恆溫功能的蓄水裝置】",
    "【建造所需材料：小型電子元件*1，鐵*30，銅*20，秘銀5，初級元素結晶*2】",
    "（註：建造成功後，需投入一塊初級魔能水晶，可提供蓄水裝置兩個月的能源。）",
    "…",
    "看到上面的介紹，曹星一樂。",
    "「這特麼不就是熱水器嗎？」",
    "「這感情好啊！以後就不需要我們自己動手燒水洗澡了。」",
    "想到這裡，曹星決定明天就給每間居民房中都建造一個。",
    "片刻後。",
    "柳慕雪也已經洗漱完畢。",
    "她歪著腦袋，擦著濕漉漉的頭髮，如同一個出浴的仙子。",
    "看到曹星後，柳慕雪輕聲道：「阿星…水已經燒好了，我先上去暖床，你洗完澡就上來……」",
    "「好。」",
    "曹星點頭答應，然後也痛痛快快的洗了個熱水澡。",
    "…",
    "領主小屋二樓，這裡的溫度同樣很舒適。",
    "兩邊是燃燒的火爐，供暖管道也在不斷輸送暖氣。",
    "對於大部分倖存者來說，這簡直是天堂！",
    "從今天邱雅婷向曹星索要保暖衣物就能看出來，大部分倖存者此時還處於一個挨凍的狀態。",
    "畢竟，不是所有人都能像曹星一樣，不僅將篝火升級到了熔爐，還建造出來了供暖管道。",
    "哪怕是發展不錯的方龍，他的領地篝火也只是剛剛升到6級。",
    "在夜晚，大部分倖存者都只能縮在火爐旁邊入睡。",
    "有張被子都算不錯了。",
    "與此同時，柳慕雪從被窩中探出半個腦袋，然後拍了拍旁邊的枕頭，輕笑道：「阿星，被窩已經暖和了，快進來吧。」",
    "「好的。」",
    "曹星褪去了外衣，然後鑽入了溫暖的被窩。",
    "下一刻，一雙修長且帶有溫度的長腿向著他勾了過來。",
    "二人對視，柳慕雪那絕美的臉上帶著一些羞怯，還有一絲期待。",
    "片刻後，小木床再次傳來輕響聲，伴隨著美人兒的嬌媚聲。",
    "被窩裡，柳慕雪扭動著曼妙的身姿，讓曹星一陣陣如墜雲間。",
    "直到一小時後。",
    "美人兒一陣急促的呼吸。",
    "她滿足的躺在了曹星的懷中……",
    "二人靜靜地相擁著，感受著彼此的體溫。",
    "柳慕雪的長腿搭在曹星身上，輕輕摩挲著。",
    "光滑的觸感不斷撫過。",
    "相比起夏燕妮和莎拉，柳慕雪的身材比例是最勻稱的，尤其是她的那雙修長而又緊緻的美腿，堪稱是完美的藝術品。",
    "當然，這並不是說夏燕妮和莎拉不如柳慕雪，只能說是各有特色。",
    "幾分鐘後，柳慕雪抬起腦袋，道：「阿星……今天我爸媽又給我發信息了，他們想讓我給他幾張毛皮。」",
    "「但是我沒有給，而是讓他們拿2000木材或者1000個石塊跟我們交換。」",
    "曹星聽罷一樂，「他們給了嗎？」",
    "這麼多的資源，對於當前階段的倖存者來說，可是一筆不小的數字了。",
    "柳慕雪搖了搖頭：「沒有，他們說手上沒這麼多。」",
    "「我就讓他們別把兩個弟弟寵太狠，讓他們也去工作。」",
    "曹星點了點頭，「可以，如果他們採集到了那麼多資源，跟他們交易幾張狼皮也沒什麼。」",
    "畢竟對曹星來說，這也是一筆不虧的買賣。",
    "柳慕雪輕點螓首，絕美的五官下，忽然出現了一個狡黠的笑容。",
    "「對了阿星…你今晚有想好，要去哪位美人的房間中嗎？」",
    "曹星聽到這話，頓時瞪大了眼睛，然後乾咳了幾聲。",
    "「咳咳！你在說什麼呢慕雪？」",
    "柳慕雪聽罷，笑得更加燦爛了。",
    "她像是並不在意這些，輕聲道：「阿星…其實我看得出來，我們的那些領民們對伱的情感……」",
    "「在白天的時候，莎拉和蕾妮斯的火熱眼神，恨不得都快把你吃掉了……」",
    "「我也知道，這個領地里，大家都很愛戴你，也很尊敬我……」",
    "「所以呢，既然身為領主，我就不能獨享你的愛！」",
    "柳慕雪握著小粉拳，目光堅定的說道。",
    "聽到這話，曹星更加尷尬了起來。",
    "他剛想解釋什麼，卻聽門外傳來了敲門聲。",
    "咚咚咚！",
    "曹星疑惑道：「誰？」",
    "片刻後，門外傳來聲音：「我……莎拉…有件事需要向領主大人匯報……」",
    "曹星頓時尷尬的看向枕邊人，然後說道：「我讓她明天再來吧。」",
    "卻見柳慕雪掩面輕笑，「去吧去吧，萬一是有什麼重要的事呢。」",
    "「記得早點回來~」",
    "看到曹星還是有些尷尬，柳慕雪繼續道：「不用顧慮太多，快去吧快去吧。」",
    "曹星聽罷嘆了口氣。",
    "然後從床上爬起，穿好了衣服走出了領主小屋。",
    "推開大門，曹星便看到這個美麗的暗精靈，正低著腦袋站在一旁。",
    "兩隻尖尖的耳朵豎立，給人一種嬌弱的感覺。",
    "「莎拉，怎麼了？」",
    "聽到曹星的聲音，莎拉抬起了腦袋，然後不由分說的拉住了曹星的手腕。",
    "曹星注意到，莎拉的眼神再次變得跟昨晚一樣炙熱。",
    "然後，她便牽著曹星，一路徑直來到了她的房間中。",
    "『嘭』的一聲把門關上了。",
    "「莎拉，你要跟我說什麼？」",
    "曹星繼續問道。",
    "莎拉沒有回答，這一次，她主動褪去了身上的刺客皮衣。",
    "在爐火的照耀下。",
    "霎時間，一具曲線完美的身體，呈現在曹星面前。",
    "然後，當著曹星的面，她主動解下了裹胸。",
    "瞬間，一對就蹦了出來。",
    "「領主大人……莎拉想要更多……」",
    "聽到這話，曹星也明白了莎拉現在的狀態。",
    "然後，他點頭道：「那就跟昨天一樣吧，莎拉？」",
    "「嗯……」",
    "莎拉輕聲回應，然後跪伏在了曹星面前。",
    "十幾分鐘後，莎拉站起身來，然後擦了擦嘴角。",
    "而曹星則是將她輕輕的抱了起來。",
    "莎拉的身高差不多在一米六，被曹星摟在懷中，顯得很嬌小。",
    "而且她的體重很輕，曹星感覺甚至連90斤的不到。",
    "在小木床上。",
    "莎拉一如昨晚一樣，非常熱烈。",
    "這具完美的胴體不斷散發著灼熱的溫度，仿佛要將曹星給融化。",
    "「領主大人……領主大人……」",
    "「唔……」",
    "一聲悠長的嘆息後，莎拉軟綿無力的倒在了曹星身上。",
    "而曹星也沒有其他動作，就這麼抱著莎拉，右手輕輕撫過她那光滑的背部。",
    "幾分鐘後，莎拉像是恢復了幾分體力，聲音輕柔的說道：「領主大人……你好厲害，又讓莎拉感受到了從未有過的感覺。」",
    "此刻的她，哪還有白天那個高冷刺客的樣子，顯得無比的溫柔。",
    "曹星笑了笑，沒有說話。",
    "而就在這時，莎拉那薄薄的嘴唇下，忽然勾起了一抹弧度。",
    "「其實，那個阿斯卡隆的女人，也想去找你的……」",
    "「但是我想比她更早感受領主大人的關愛，所以我就決定先去把你帶過來……」",
    "曹星聽罷愣了一下，難怪莎拉這麼早就去敲他的房門。",
    "這時候，莎拉貼在曹星的耳邊，輕聲道：「不過……一會兒你可以去找下這個阿斯卡隆女人……」",
    "她那尖尖的耳朵打在曹星身上，在加上莎拉的氣息，似乎又勾起了某種心理。",
    "曹星看了她一眼。",
    "然而，在莎拉驚訝的目光中，他忽然翻了個身，將莎拉反壓在了身下。",
    "莎拉在最初的驚慌後，臉色變得更加羞紅。",
    "她歪過去腦袋，一隻長長的精靈耳朵對著曹星，顯得那麼的嬌羞，可人。",
    "房間中，再次響起了陣陣呼吸聲。",
    "又過了一個多小時。",
    "暗精靈美人在他的懷中身體一顫，然後四肢繃緊，修長的手臂緊緊抓住了曹星。",
    "片刻後，莎拉一陣陣喘息聲傳來，胸口也劇烈的起伏，直接癱軟了下去。",
    "曹星也逐漸感到體力不支。",
    "相比起三階首領級別的莎拉，他一個二階的法師還是體質差了點。",
    "曹星抹了抹額頭的汗。",
    "而莎拉紅潤的臉上，帶著滿足的笑意，在曹星胸口親吻了一下。",
    "幾分鐘後，莎拉從床上站起身來，似乎準備穿衣服。",
    "曹星一愣，然後問道：「大半夜你還要出門嗎？」",
    "莎拉點頭道：「是的，領主大人，夜晚的雪原同樣危險，需要有人值守領地。」",
    "「我不太放心那些新人的能力。」",
    "「所以我們商量了一下，上半夜是我負責領地的安全。」",
    "「下半夜是蕾妮斯，明天就是阿薩姆和安德魯了。」",
    "曹星聽罷恍然點了點頭。",
    "莎拉說的這三個人，包括她自己，都是忠誠度達到100以上的領民。",
    "沒想到，他們還會主動幫曹星承擔守衛領地的工作。",
    "可能這就是忠誠度100後的隱藏功能吧。",
    "當著曹星的面，莎拉重新將她那飽滿的胸脯纏繞了幾圈白布，然後又穿上了緊身皮衣。",
    "兩把幽影之刃被她握在手中。",
    "換上裝備後的莎拉，如同變了個人，充滿了嚴峻與肅殺。",
    "「我出去了。」",
    "說完，莎拉便無聲無息的消失在了原地。",
    "曹星思索片刻，也站起身來，重新穿好了衣服。",
    "在路過蕾妮斯的房間時，曹星摸了摸自己的腰子。",
    "最終，他還是沒有進去。",
    "然後，他一溜兒鑽回了自己的領主小屋中，免得又被哪個娘們截胡了！",
    "當曹星回到領主小屋時，柳慕雪正瞪著水汪汪的大眼睛，嘴角帶著俏皮的笑容看向他。",
    "「回來了，阿星。」",
    "曹星點了點頭，然後鑽入了柳慕雪的被窩中。",
    "二人相擁入睡，一切盡在不言中……",
    "後半夜。",
    "曹星隱隱聽到領地附近出現幾道撞擊聲。",
    "其中一道撞擊聲似乎就出現在領地附近。",
    "轟隆！",
    "劇烈的震動讓領主小屋輕輕搖晃。",
    "曹星和柳慕雪一起睜開眼睛，傾聽了片刻。",
    "沒有聽到其他動靜後，便安然睡去。",
    "「睡吧慕雪，應該又是冰巢，以我們的領地防守能力，不需要擔心這個。」",
    "柳慕雪眨巴著好看的眼睛，然後點了點頭。",
    "二人再次睡去。",
    "…",
    "然而，曹星的領地雖然可以抗住冰巢怪的衝擊，但其他倖存者的領地就沒有那麼好運了。",
    "這一晚，很多倖存者領主都在半夜被震動驚醒。",
    "當他們頂著寒冷的冬夜，走出領主小屋時，頓時看到十幾隻，乃至幾十隻冰巢怪朝著領地就沖了過去。",
    "瞬間，這些倖存者領主眼中出現驚恐之色。",
    "「警戒！警戒！」",
    "「有冰巢怪襲來了，快把所有戰鬥人員叫出來！」",
    "「該死的！」",
    "嘭！嘭嘭！",
    "那些冰巢怪瘋狂撞擊領地中的建築。",
    "戰鬥瞬間打響。",
    "這是新手保護期結束後的第一晚。",
    "倖存者們還沒有適應，這個世界的殘酷節奏。",
    "即使是在晚上，也不能安心入睡，必須留下人值守。",
    "冰巢怪的攻勢一如既往的猛烈。",
    "一部分倖存者，配合他們的領民艱難的抗住了這一波攻擊。",
    "但還有一部分倖存者領地，在深夜被冰巢怪吞沒。",
    "以往在半夜比較安靜的聊天頻道，也被大量的信息刷屏。",
    "王碩：「該死啊！這些狗日的冰巢怪，大半夜也不消停，特麼的，我差點就在睡夢中被吞了。」",
    "白蒙休：「有沒有在坐標8313，24521，52311附近的兄弟，我領地外面出現了兩個冰巢，好多怪物出現，快有些撐不住了，誰來救救我？」",
    "蔡友：「這個見鬼的世界，白天就已經夠難的了，晚上還這樣不讓人消停，明天怎麼去開採資源啊？」",
    "聊天頻道一片怨聲載道。",
    "不光是曹星所在的174區聊天頻道，世界頻道也同樣被各種信息瘋狂刷屏。",
    "萊斯特·格雷斯：「法克！我在外面尿尿，剛掏出傢伙，一個冰巢就砸在我面前，好消息是我擋住了冰巢怪的攻擊，壞消息是我已經感覺不到老二的存在了！」",
    "夏爾馬-彌婭：「這是什麼鬼世界，我們完全就是來受苦的，現在冰巢怪已經衝破了我的領地，我馬上就要死了，就是不知道，在這個世界死後，能不能繼續投胎成婆羅門……」",
    "長谷一政：「喲西！一個冰巢裡面的怪物足夠我升到8級，再來兩個，我就可以直接升到10級了，我滴亡靈手下真是大大的厲害！」",
    "高智穎：「兄弟們，堅持住，這些冰巢是危險也是機遇，能給我們帶來大量的經驗值，大家早日升到10級，突破到二階就輕鬆了！」",
    "王騰：「哈哈哈！該死的冰巢怪，統統過來吧！我已經到9級了，再升1級，我就可以直接突破二階，這些冰巢怪將再也無法奈何我！」",
    "…",
    "在危機面前，每個人都有不同的反應。",
    "有的把這當成機遇，有的則是驚慌失措。",
    "但不管如何，他們也只能適應過來，抓緊每一分每一秒的發展機會。",
    "而這些，跟曹星無關。",
    "他們的領地已經築起了高牆，箭塔，還有強大的手下24小時值守。",
    "二人後半夜倒是睡得比較安穩。",
    "次日……",
    "曹星剛睜開眼睛，一條系統提示出現。",
    "【所有倖存者請注意：你們已度過正式期第一天。】",
    "【冰巢出現的頻率和怪物等級，將會逐步提升。】",
    "【擊殺精英級以上冰巢怪物時，將會有小概率掉落特殊道具：冰龍號角】",
    "【天氣預告：今日狂風雪原區域，將會迎來一陣寒風，最低氣溫將達到-60℃】",
    "…",
    "看到系統提示，曹星疑惑道：「冰龍號角又是什麼東西？」",
    "而這時，柳慕雪也掃了一眼聊天頻道，眼中出現擔憂的神色道：「阿星，昨晚好像又死了不少人……」",
    "曹星看了一眼。",
    "【174區當前在線人數：30412/40173】",
    "新手保護期七天死了一大批，正式期第一天又死了一批。",
    "現在他們這個區的人數都快跌破三萬了。",
    "其他區的情況，估計也差不多，甚至有可能比他們更差。",
    "曹星點了點頭，「是啊，這也是沒辦法的事，畢竟沒有領地保護了。」",
    "「再加上冰巢怪的等級還在不斷提升，其他倖存者們只有抓緊每一分每一秒的發展時間，才能在冰巢的威脅下，活下來。」",
    "聽到這話，柳慕雪也握緊了拳頭。",
    "當然，曹星的時間倒是沒有那麼緊迫，因為他的進度已經領先了其他倖存者不知多少。",
    "片刻後，他說道：「起床吧，慕雪。」",
    "「嗯。」柳慕雪輕聲回應。",
    "二人簡單的洗漱一番後，來到了領主小屋外。",
    "幾十號極地人，領民曹一，以及樹靈族都在恭敬的等待著。",
    "看到曹星後，所有人均行了個禮。",
    "「尊敬的領主大人，願你安康。」",
    "「美麗的領主夫人，祝你永遠容顏常駐。」",
    "曹星點了點頭，然後看向旁邊的兩個半人馬。",
    "「坎特爾，坎達爾，昨晚是不是有冰巢砸下來了？」",
    "半人馬邁動馬蹄，『嘚嘚嘚』的走了過來。",
    "他們同時點頭道：「尊敬的領主大人，如你所見，昨晚確實有四個冰巢砸在了我們領地附近。」",
    "「我們把那些新人從被窩裡揪了出來，然後和強大的莎拉女士一起，將外面的冰巢怪全部擊殺了！」",
    "兩個半人馬臉上帶著得意的神色。",
    "而愛莉和希露薇亞，還有幾個帝國士兵，臉上均有些幽怨。",
    "她們半夜睡的好好的，結果被一陣震動驚醒。",
    "還沒等她們反應過來，坎特爾的大嗓門就開始在門外叫喚。",
    "然後，她們也只能迅速從床上爬起，跟著坎特爾他們連夜出去戰鬥。",
    "坎特爾這時走了過來，將一堆冰龍印記和其他材料掏了出來，雙手呈上。",
    "「領主大人，這是我們昨天的收穫，請你過目。」",
    "曹星點了點頭，然後將這些材料全部收進了背包中。",
    "【獲得：冰川裂片*243】",
    "【獲得：冰龍印記*497】",
    "【獲得：小型混沌之書*5】",
    "【獲得：小型精神之書*3】",
    "【獲得：冰晶石（綠）*32】",
    "曹星滿意點了點頭，「做的不錯，坎達爾，坎特爾，你們辛苦了。」",
    "……",
    "(本章完)"
  ],
  "updatedAt": "2026-06-23T00:00:00.000Z"
}