{
  "novelId": "global-descent",
  "chapterNo": 223,
  "sourceLang": "cn",
  "targetLang": "cn",
  "title": {
    "source": "第223章",
    "translated": "ตอนที่ 223"
  },
  "status": "source",
  "paragraphs": [
    "全球降臨：帶著嫂嫂末世種田",
    "黑暗水晶球，三個童話故事（6000）",
    "黑暗水晶球，三個童話故事（6000）",
    "投票推薦 加入書籤 小說報錯",
    "黑暗水晶球，三個童話故事（6000）",
    "聽到這話，曹星再次若有所思。",
    "這麼說起來，自己剛剛碰到的那個士兵，就是古堡中的試驗品。",
    "也就是說，這個古堡裡面還有很多士兵了？",
    "要知道，他剛剛還想多擊殺一些融合士兵，爆出大量的【靈魂珠】用來提升自己呢。",
    "而按照老巫嫗所說，那群士兵只會在晚上，才出現在古堡之中。",
    "當然，他也沒有全信這個老巫嫗所說的。",
    "曹星繼續問道：「那老人家，你知道進入古堡的方法嗎？」",
    "聽到這話，老巫嫗緩緩道。",
    "「那個邪惡女巫布下的結界非常強大……即使是我……也沒辦法破解她的結界……」",
    "曹星眼中頓時出現失望之色。",
    "而這時，老巫嫗話鋒一轉。",
    "「不過……在前幾天，有一個女娃子為我送來了遺失的水晶球……」",
    "曹星瞬間就想到了，上次一起進入女巫森林的那批倖存者。",
    "曹星問道：「你說的那個女娃子，是不是跟我一樣的存在。」",
    "「是跟你一樣…身上有著另一個世界的氣息……不過，她比你要弱很多……」",
    "「我也沒想到…這麼弱小的人類，居然成功穿過了這麼危險的森林…並且還帶來了我遺失的東西……」",
    "「不過…她好像嚇壞了…說自己的隊員們都死在了森林…只剩下她找到了我……」",
    "「我安慰了這孩子，給了她足夠的獎勵……並且送她離開了森林……」",
    "曹星眼中出現恍然之色。",
    "他也明白了，邱雅婷所說的任務是什麼。",
    "就是給這個老巫嫗送水晶球。",
    "沒想到，她們居然真的完成了這個任務。",
    "只不過代價是，她的所有隊員都死光了，只剩下她一個人活著。",
    "至於這中間發生了什麼，曹星就不得而知了。",
    "曹星沒有管邱雅婷的任務是怎麼完成的，繼續問道：「你的意思是，這顆水晶球可以幫我們進入女巫古堡？」",
    "老巫嫗點頭道：「是的……這是一顆非常神奇的水晶球……它的力量已經被我激活了……」",
    "聽到這話，曹星眼中出現好奇的神色。",
    "「可以把這顆水晶球給我們嗎？我們想去古堡中看一看。」",
    "「用完後我們會還給你的。」",
    "「當然，你看看需要什麼東西，我們可以交換。」",
    "聽到這話，老巫嫗那渾濁的目光中，出現了一抹隱藏極深的神色。",
    "就好像是，等待已久的垂釣者，終於等到了魚兒上鉤的表情……",
    "老巫嫗發出刺耳的笑聲，就連聲線都抬高了幾分。",
    "「我不需要什麼東西……」",
    "「我只需要……你們能幫我……殺了那座古堡中的女巫……」",
    "聽到這話，曹星心中一驚。",
    "他也在一瞬間，明白了老巫嫗的目的。",
    "曹星問道：「你想對付古堡中的女巫？」",
    "老巫嫗點了點頭，「沒錯…她是個邪惡的存在……」",
    "「我在這裡等待了很多年……就是在等待有人能進入古堡，並且殺了她……」",
    "曹星聽罷，眼中出現思索的神色，沒有馬上做下決定。",
    "畢竟他的打算只是進入古堡探索一下。",
    "那個女巫能布下這種結界，一定很強，曹星也沒把握對付她。",
    "老巫嫗直接從懷中，取出了一顆黑色的水晶球。",
    "上面散發著一股神奇的黑暗氣息。",
    "「給……年輕的探險者……」",
    "「你先看看這顆水晶球……」",
    "【獲得：黑暗水晶球（橙）*1】",
    "曹星心中暗暗一驚，這居然是個史詩品質的東西。",
    "他默不作聲的看了眼屬性。",
    "【道具效果：可構建兩道黑暗傳送門，互相連通，兩道傳送門最遠距離為5米，持續時間60秒，每7天可使用一次。】",
    "好傢夥，這居然是一個傳送道具。",
    "而且，它的作用十分恐怖！",
    "也就是說，只要有這顆水晶球在手。",
    "對於曹星來說，像一些封印的大門，或是特殊區域，基本上是形同虛設了！",
    "這時候，他忽然想到了一件事情。",
    "心中思索道：「我記得，在阿斯卡隆的地下宮殿中，還有一座封印起來的寶庫。」",
    "「據說需要具有阿斯卡隆王室血脈的存在，才能開啟大門……」",
    "很顯然，短時間內，曹星根本沒有機會前往幽蘭王國，尋找那具有阿斯卡隆王室血脈的人。",
    "如果有這玩意的話，是不是不需要找到王室血脈，也可以直接進入地宮寶庫了？",
    "畢竟，那裡面可是有著關於修復【上古寶劍-馬格戴爾】的線索，還可能有著大量的寶藏！",
    "想到這裡，曹星眼中逐漸浮現出了一抹貪婪的神色。",
    "甚至下意識想把這個水晶球順走。",
    "然而，他並沒有實施這個想法。",
    "因為曹星知道，眼前這個老巫嫗，絕對不像表面看起來這麼簡單。",
    "老巫嫗那如同老貓的眼睛，看到了曹星的反應，似乎猜出了他心中的想法。",
    "布滿褶皺的臉上，出現一抹恐怖的笑容。",
    "「嗬嗬……年輕的冒險者喲……這是一個神奇的水晶球，它能帶你穿過任何一扇大門……」",
    "「如果你能殺掉古堡中的那位邪惡女巫，這顆水晶球，我可以直接送給你……」",
    "與此同時，系統提示出現。",
    "【是否接受林中巫嫗的委託：擊殺古堡女巫？】",
    "【任務獎勵：黑暗水晶球（橙）*1】",
    "看著任務信息，曹星思忖片刻。",
    "眾人也都站在原地，似乎等待他的決定。",
    "包括眼前的老巫嫗，也有些期待的看著曹星，",
    "然後，他搖了搖頭道：「算了。」",
    "老巫嫗眼中出現疑惑之色，似乎十分不解。",
    "曹星點了點頭，「按照你所說，那座古堡中的女巫能設下這種結界，實力一定極其強大。」",
    "「我們實力不夠，還是不冒這個險了。」",
    "聽到這話，老巫嫗似乎有些著急了。",
    "她連忙道：「年輕的探險者喲……」",
    "「雖然那個邪惡的女巫很強……但你們這群人的實力也不弱……」",
    "「而且，那個女巫的身體出了一些問題，並不能發揮所有的力量……」",
    "「我認為，你們是可以完成這個任務的，當然，這需要一點運氣……」",
    "然而，曹星還是搖頭，沒有答應。",
    "老巫嫗見此，渾濁的目光中似乎明白了什麼。",
    "「年輕的探險者……這樣如何……」",
    "「如果你們能進入古堡，擊殺那名邪惡女巫……",
    "「除了這顆水晶球，我還可以告訴你一件傳說物品的下落……」",
    "聽到這話，曹星嘴角出現一抹微不可查的笑意。",
    "女巫古堡，他肯定是要進去探探的。",
    "他就是想要找這個神秘的老巫嫗，索要更多獎勵罷了。",
    "現在看起來，他似乎成功了。",
    "曹星不露聲色的按下了心中的想法，疑惑道：「傳說物品？是什麼？」",
    "老巫嫗回憶了一番，繼續發出刺耳的響聲，「那件傳說物品，叫做肇始之盾——安諾迪特……」",
    "「這是某位傳奇騎士使用過的盾牌，上面有著空氣與生命女神，德薇娜的神力……」",
    "聽到這話，曹星眼中也是閃過一絲驚訝的神色。",
    "居然是一件傳說級的盾牌。",
    "在此之前，他已經知道，任何一件傳說裝備都有著無比強大的效果。",
    "而這面【肇始之盾——安諾迪特】，想必也有其特殊之處。",
    "如果能弄到手，不管是給柳慕雪還是給布隆，想必都能為他帶來極大的提升。",
    "於是，曹星直接說道：「好，我接受了。」",
    "【成功接受任務：擊殺古堡女巫】",
    "【任務進度：進入古堡，擊殺女巫：0/1】",
    "聽到曹星接受，老巫嫗臉上，再次出現了恐怖的笑容。",
    "曹星有些受不了這個老人的笑，直接將【水晶球】收進了背包中。",
    "然後說道：「這位老人家，那我們先告辭了。」",
    "反正該弄到手的已經弄到手了。",
    "說完，他就準備帶人離開。",
    "而這時，老巫嫗叫住了他們。",
    "「年輕的探險者喲，請等一下……」",
    "曹星疑惑道：「還有什麼事嗎？」",
    "老巫嫗點了點頭，「你們在進入古堡前，先聽我講三個故事如何？」",
    "曹星問道：「這跟我們接下來的行動有關聯嗎？」",
    "曹星見此，直接道：「好，你講吧。」",
    "「第一個故事，是一匹狼的故事……」",
    "她的聲線產生了變化，給人一種滄桑，古老的感覺。",
    "「在許多年前，有一匹在馬戲團工作的狼，從小便受到了嚴苛的訓練，馬戲團的人每天帶著它，上演小紅帽的故事。」",
    "「這個故事是：狼吃掉了小紅帽和外婆，然後被獵人追殺，獵人剖開狼肚子，小紅帽和外婆奇蹟般的復活。」",
    "「他們的演出非常精彩，每一次都能獲得滿堂喝彩，觀眾們也非常愛看這場表演。」",
    "「而就在某一天，這匹狼在舞台上發狂，它的身體變得十分高大，並且能跟人一樣站起來，眼中帶著滲人的紅光，當著所有人的面，它吃掉了小紅帽，吃掉了外婆……」",
    "「觀眾們在下面拍手叫好，為這匹狼那完美的表演而喝彩……」",
    "「然而，當這匹狼跳下舞台，並且開始用它那恐怖利爪，撕碎一個個人類的身體時，那群觀眾們才終於開始慌亂……」",
    "「狼殺光了在場的所有人，將每個人的腸子扯出來，連接在一起。」",
    "「然後，它同樣受到了獵人的追殺，在一片森林中，這匹狼中箭，倒了下去。」",
    "「獵人迅速走過去，剖開了這匹狼的肚子，不過，這次肚子裡頭沒有祖孫兩人蹦出來，反而是兩顆魔豆……」",
    "聽完老巫嫗講完，曹星若有所思。",
    "很顯然，這是小紅帽與大灰狼的故事，只不過是另一個版本。",
    "老巫嫗頓了頓，繼續道。",
    "「第二個故事，是一個食人魔的故事。」",
    "「很久以前……森林中住了個食人魔……」",
    "「他不知什麼時候出現在森林的，沒有人知道他的過去，只知道他非常喜歡吃人！」",
    "「這個食人魔精通烹煮人肉的藝術……」",
    "「附近村落的孩子們都快被他抓來吃光了！」",
    "「直到某一天，有一位王國的公主出現在了森林中，並且被這個食人魔抓了去。」",
    "「國王得到消息後非常生氣！他馬上派出了大量的騎士團，前來圍捕這名食人魔。」",
    "「然而，當人們再次進入森林的時候卻發現，國王派出的騎士和士兵，包括那位公主，以及食人魔全部消失在了森林中，再也沒有出現……」",
    "老巫嫗講完，場上的眾人紛紛陷入了思索之中。",
    "她的這個聲線非常沙啞，沉重，似乎天生就適合用來講各種恐怖故事。",
    "不過，關於這個食人魔的故事，曹星倒是沒有聽過。",
    "「第三個故事，是一位王國的公主……」",
    "「很久以前……有著一位非常美麗的公主，她的樣貌如同天上的月亮，讓人垂青，許多鄰國的王子都來到這個國家，想要迎娶這位公主……」",
    "「然而……國王為了不讓其他人打公主的主意，他專門修建了一座百米高的高塔，並且將公主關在了高塔裡面，並且禁止任何人與她接觸……」",
    "「之後，國王每天給公主帶來食物和水……」",
    "「王后清楚的知道這一切，在某一天，她想把自己的女兒從高塔中放走，然而卻被國王發現……」",
    "「日子一天天過去，公主頭髮也越來越長……」",
    "「直到某一天……她的頭髮達到了百米長，足夠她從高塔中滑下來……」",
    "「隨著遇難的人數越來越多，那座高塔的傳說也逐漸流傳開來……從此以後……那片區域成為了一個鮮有人踏足的禁地……」",
    "聽完這三個故事，曹星若有所思。",
    "很顯然，這跟她之前說的，古堡中的怪物有關聯。",
    "曹星直接道：「你說的這三個故事，就是之前你跟我說的三種怪物嗎？」",
    "老巫嫗發出尖銳的笑聲。",
    "「是的……你們要想見到古堡中的女巫，必須先打敗這三位……」",
    "「它們一個比一個強大，如果你們能找到對方的弱點，可以更輕鬆的擊敗它們……」",
    "「沒錯……他們的弱點，就藏在我說的故事裡……」",
    "聽到這話，曹星也明白了，老巫嫗講這三個故事的目的。",
    "與此同時，系統提示出現。",
    "【擊殺森林女巫任務已變更】",
    "【任務目標：擊敗城堡三大守護者，大野狼，食人魔，長髮公主，0/3】",
    "【前往古堡最高層，擊敗森林女巫：0/1】",
    "【任務獎勵：黑暗水晶球（橙）*1，肇始之盾——安諾迪特的線索……】",
    "老巫嫗說完這些，貓眼中再次出現幽綠的目光。",
    "「這位年輕的探險者喲……祝你們好運……嗬嗬嗬……」",
    "「再次提醒一下……古堡只有在晚上才會顯露它本來的面目，你們需要在晚上進入……」",
    "說完，她便關上了小木屋的大門。",
    "聽到這話，曹星眼中出現若有所思的神色。",
    "「晚上才會顯露真實面貌嗎？」",
    "【距離夜幕降臨：1時17分鐘……】",
    "曹星沒有多說，而是帶著眾人迅速離開了這裡。",
    "此刻，隨著時間不斷流逝，女巫森林的環境愈發昏暗，即將來到夜幕降臨之時。",
    "柳慕雪也注意到了這點，然後輕聲問道：「阿星，我們今晚要進去古堡裡面嗎？」",
    "曹星思索片刻，搖了搖頭道：「今晚先不進去。」",
    "「按照那個老巫嫗所說，這座古堡裡面的怪物，等級應該蠻高的。」",
    "「我們今晚也不回領地了，就在森林中休息一晚。」",
    "「明早繼續探索女巫森林，爭取把古堡附近的怪物都給清了，多弄些【高級力量之心】和【中級力量之心】出來，讓我們突破。」",
    "「實力提升上去後，才有更大的把握。」",
    "聽完曹星的分析，眾人紛紛點了點頭。",
    "很顯然，他的決策是對的。",
    "曹星依舊保持著前面穩當的風格。",
    "在得到【黑暗水晶球】，並且在看到任務獎勵後，而直接一頭扎進去。",
    "他依舊選擇穩紮穩打，確保自己擁有足以應對古堡危險的實力後，再選擇進入。",
    "這也是阿薩姆等人敬重曹星的原因之一。",
    "有時候在戰場上，一昧的衝鋒可能效果顯著，但會付出更大的傷亡。",
    "合理分析自己的實力，在戰鬥前儘量提升自己，才能走得更遠。",
    "而且，那個老巫嫗又沒有要求他們在什麼時間內完成。",
    "曹星想啥時候進入就啥時候進入。",
    "拉布此時激動道：「領主大人，今晚我們要在森林中過夜嗎？」",
    "拉布頓時回道：「太好了！野豬戰士最喜歡森林了！」",
    "「對了領主大人，你們要不要去我們野豬部落休息？」",
    "聽到這話，曹星也想了起來。",
    "在這座森林中，有一個野豬部落，裡面的氣溫很舒適，還有現成的休息室。",
    "發現野豬部落所在的位置，距離他有十幾公里，也不算太遠。",
    "於是，曹星點頭道：「好，那我們今晚就去野豬部落中休息一晚。」",
    "聽到這話，場上的眾人臉上都出現了笑容。",
    "他們現在都是三四階的強大存在。",
    "憑藉眾人的體質，在森林裡硬抗一晚上倒也沒什麼。",
    "但如果有一個溫暖的居所，很顯然也是件不錯的事。",
    "「楚楚，跟你媽媽說一聲，報個平安，讓她不用擔心。」",
    "童楚楚跟在埃麗莎旁邊，小腦袋連點，「嗯嗯，好的大哥哥！」",
    "說完，她就去聯繫夏燕妮了。",
    "而旁邊的埃麗莎說道：「領主大人，也跟我父親說一聲吧，不然他會以為我和你夜不歸宿，在外面偷偷做什麼呢！」",
    "曹星無語的看著她，「知道了。」",
    "然後，他按住了耳朵上的通訊裝置，撥通了伊勒娜的通訊。",
    "片刻後，耳邊響起了伊勒娜的聲音。",
    "伊勒娜似乎不太習慣用這種科技裝置。",
    "曹星直接說道：「伊勒娜，今晚我們不回領地了。」",
    "「你去通知下其他人，所有工作照常進行。」",
    "聽到這話，伊勒娜輕聲回道：「好的領主大人，您在外面小心點，記得注意保暖，還有想我哦～」",
    "吩咐完這些，曹星便準備掛斷通訊。",
    "他腦海中忽然閃過了一個想法。",
    "目前，領地中除了伊勒娜和三個女龍血鬥士之外，還有兩百多號戰鬥人員。",
    "這是一股非常強悍的力量。",
    "那些士兵晚上除了值崗外，沒什麼事做。",
    "是不是可以使用一波【冰龍號角】，召喚冰巢怪出來刷一刷積分和冰龍印記？",
    "憑藉他們的實力，應對中等冰龍號角挑戰嗎，可能有些困難。",
    "但如果是應對【冰龍號角（小）】中召喚出來的怪物，則是完全不在話下。",
    "想到這裡，曹星補充道：「對了伊勒娜。」",
    "「繼續通知下去，告訴那些士兵，晚上做好戰鬥準備。」",
    "「晚上我會使用一個小型的冰龍號角，到時候會有大量的冰巢怪降臨。」",
    "「你帶領三名龍血戰士，還有兩個半人馬組織好隊伍。」",
    "「應對那些冰巢怪的襲擊。」",
    "上一章 章節目錄 下一章",
    "溫馨提示：按 回車[Enter]鍵 返回書目，按 ←鍵 返回上一頁， 按 →鍵 進入下一頁，加入書籤方便您下次繼續閱讀。"
  ],
  "updatedAt": "2026-06-25T04:25:16.000Z"
}