{
  "novelId": "global-descent",
  "chapterNo": 498,
  "sourceLang": "cn",
  "targetLang": "cn",
  "title": {
    "source": "第498章",
    "translated": "ตอนที่ 498"
  },
  "status": "source",
  "paragraphs": [
    "裂天一爪，滅殺傳奇！（5600）",
    "一條冰龍能夠造成6段傷害。",
    "六條加起來就是足足36段傷害！",
    "而且其中還有24段是雙倍傷害！",
    "曹星只能看到，前方出現了海量的傷害數字。",
    "當六條冰龍全部消散後。",
    "這一波爆發，直接打掉了女武神殘軀近四百萬的血量！",
    "女武神殘軀在脫離冰龍捲風暴的束縛之後，手中的火焰長劍一振。",
    "一道帶著灼熱氣息的劍氣瞬間划過。",
    "將周圍覆蓋著厚厚冰霜的牆壁切開。",
    "空氣中的寒氣瞬間被蒸發，整個劍冢都被一股朦朧的水霧籠罩。",
    "她似乎對於曹星剛剛的這波攻擊感到憤怒，想要衝過來將他斬殺。",
    "然而現在，依然處於布隆的【巨人咆哮】持續時間。",
    "女武神殘軀不得不繼續攻擊布隆。",
    "手中的長劍不斷劈砍，使布隆血量一截一截的下降。",
    "而在布隆身後，伊莎貝爾不斷翻閱聖典，一個個治療技能瘋狂丟出，回復他的血量。",
    "包括莎拉和阿薩姆，也在不斷為布隆分擔壓力。",
    "戰鬥到現在，他們已經打掉對方快一千三百多萬血量了！",
    "然而，這個女武神殘軀看起來依然生龍活虎的樣子。",
    "曹星一邊丟著法術，一邊在心中計算著對方的血量。",
    "「按照84級的龍語者有近一千萬血量血量來計算。」",
    "「這個女人的等級絕對不低於90級，也就是算她滿級100級。」",
    "「那麼保守估計是1500萬血量！」",
    "「再加上她是變異主宰級生物，真正的血量可能達到兩千六百萬。」",
    "「也就是說，我們現在差不多打掉了對方一半的血量。」",
    "想到這裡，曹星再次迅速思考了一番。",
    "按照他們現在秒輸出達到一百萬來計算。",
    "布隆的巨人咆哮還有12秒的持續時間。",
    "也就是說，他們完全能在這個嘲諷技能結束之前，斬殺敵人。",
    "當然，前提是敵人是個木樁，不會反抗。",
    "而這個女武神殘軀不僅十分靈活，她的戰鬥經驗也是刻在骨子裡的。",
    "在意識到自己無法短時間內斬殺敵人之後，她直接放棄了攻擊動作。",
    "然後一個騰躍，跳到了百米高的高空中。",
    "金色的面具之下，那雙深棕色的瞳孔帶著漠視一切的神色。",
    "她單手握住長劍，將其緩緩抬起。",
    "而上面燃燒的火焰也隨之熄滅。",
    "下一刻，一股無形的氣息忽然將眾人籠罩。",
    "曹星凝重道：「又是一種新的爆發技能嗎？」",
    "雖然這個技能只是剛剛釋放，還不知道具體威力。",
    "但不用想，這一招也絕對十分恐怖！",
    "曹星剛想讓眾人後撤，拉開距離。",
    "而就在這時，他忽然發現，自己好像被定住了！",
    "不管是曹星，包括莎拉，阿薩姆等人，紛紛被定在了原地。",
    "「群體控制？還有這麼大的範圍，好特麼離譜！」",
    "還沒等曹星想好應對的手段。",
    "空中，那個女人口中輕吐幾個字。",
    "下一刻，她猛的揮劍斬出。",
    "劍氣無影無形，仿佛一陣狂風過境，直接在眾人身上掃過！",
    "所有人均感覺到，身體傳來一陣刺痛感，然後頭上也出現了一個巨大的傷害數字。",
    "五個六七十萬的傷害數字出現！",
    "整個劍冢的地面被她削去了一層！",
    "而這，僅僅只是第一劍。",
    "眼看著，她就要斬出第二劍！",
    "曹星看了眼眾人的血量，都已經下降一大截。",
    "心中升起了一股不好的預感。",
    "在電光火石間，曹星迅速做出了決定，準備使用【月神封印寶珠】，將她的這一擊打斷。",
    "然而，正當她即將斬出第二劍的那一刻。",
    "所有人的頭上身上忽然浮現出了一抹金色的光芒。",
    "三層無形的聖盾將眾人籠罩。",
    "剛好將他們身上的聖盾抵消。",
    "所有人安然無恙的站在原地。",
    "曹星見此情景，舒了口氣。",
    "「媽的……還好聖盾刷新了。」",
    "「不然要是硬承受這一擊，我們全員不死也殘血！」",
    "不得不說，這個女武神殘軀真的恐怖！",
    "剛剛這個爆發技能，70級以下，沒有保命手段的，幾乎來多少死多少！",
    "曹星也不知道，這是不是她最恐怖的技能了。",
    "但打到現在，這個女武神殘軀的戰鬥力，在一次次刷新他們的認知，簡直強大到不可思議！",
    "而天空中的女武神殘軀，在這一波斬擊沒有秒殺眾人後，也感到十分不可思議。",
    "她身影一閃，剛想衝到伊莎貝爾身邊，斬殺這個聖光系奶媽。",
    "然而，此刻的曹星直接從背包中取出了一顆珠子。",
    "隨著純淨的月神之力爆發。",
    "一團皎潔的明月，將女武神殘軀徹底籠罩，並且將其封印在了圓月之中！",
    "甚至將她最後的表情也隨之封印。",
    "曹星心中讚嘆：「不愧是能封印傳奇生物的寶珠！」",
    "「即使強大如女武神，也被我定在了原地。」",
    "而此刻，不需要曹星多說，眾人也知道抓緊時間瘋狂輸出。",
    "女武神的血量如同流水般傾瀉。",
    "而且因為對方被封印，無法進行反抗。",
    "現在他們的秒傷從100萬，直接提升到了兩百萬！",
    "在月神封印寶珠持續的第三秒，他們再次打掉了女武神五百多萬的血量。",
    "她應該只剩下差不多六百多萬血量了！",
    "在月神封印寶珠持續的第五秒，寶珠在頃刻間破碎！",
    "而對方的血量，大概還剩下兩百多萬左右。",
    "接下來的戰鬥自然沒有了多少懸念。",
    "這兩百多萬血，他們就是正面硬剛都能將其磨死。",
    "果然，又過了十秒鐘左右。",
    "陰影綻放再次爆發出一個恐怖的傷害。",
    "而此刻，正提著長劍的女武神殘軀一個踉蹌，差點摔在地上。",
    "她單膝跪地，一隻手杵著長劍，艱難的支撐著自己的身體。",
    "似乎能感覺到，自己的意識正在迅速消散。",
    "女武神深深地看了曹星一眼，逐漸沒有生息。",
    "見此情景，曹星緩緩舒了口氣。",
    "「這個女人，有些太變態了……」",
    "這是曹星戰鬥過，最為強大的敵人。",
    "這個女人太過恐怖，如果將領地里所有大師叫過來，可能戰鬥會輕鬆許多，但也有可能在對方的爆發之下，出現傷亡。",
    "但好在，憑藉曹星帶來的這些力量，完好無損解決了對手。",
    "正當曹星準備走過去，查看這個女武神的屍體時。",
    "從她的身上，再次散發出一股毀滅般的波動！",
    "火焰點燃般的聲音再次響起！",
    "這一次，不是她的武器，而是她的身體。",
    "女武神殘軀的身上，燃燒起了火紅色的火焰。",
    "並且從已經逝去的殘軀中，爆發出了一股浩瀚的力量。",
    "她不由自主的飛到了半空中，身體也開始發生了改變。",
    "身體再次拔高，金色的戰甲被染成了火紅色，背後長出了四片火焰構築而成的蝴蝶翅膀！",
    "一頭紅髮在火焰中飛舞！",
    "整個人如同沐浴在火焰中的女戰神！",
    "一股遠遠超過英雄級的氣息，在她體內升騰而起。",
    "看到這一幕，曹星頓時忍不住驚呼。",
    "「臥槽！這個女武神殘軀居然還能開啟第二形態爆發出傳奇戰力！」",
    "這一幕，即使是曹星都始料未及。",
    "包括其他人心中也浮現一股深深地無力感。",
    "像英雄級單位，他們還能想辦法正面硬剛一波！",
    "如果對方蛻變到了傳奇，那麼這場戰鬥就根本打下去的必要。",
    "整座傳承之地，都被這股傳奇級的氣息籠罩。",
    "劍冢之外的衛劍一，白芷等人，此刻正一臉驚恐的僵立在原地。",
    "因為他們發現，那股恐怖的力量之下，他們居然連動彈一下都無法做到。",
    "仿佛待宰的羔羊，等待屠夫的宣判！",
    "而此刻的曹星，心中已經迅速做出了決定。",
    "「沒辦法了，現在只能使用底牌了！」",
    "「趁著對方還沒蛻變完成，直接將其秒掉！」",
    "於是，他毫不猶豫的取出【蜥蜴人雕像】。",
    "並且往裡面投入了2枚神力碎片！",
    "而蜥蜴人雕像上面的神力值，從12點瞬間達到了32點。",
    "已經足夠使用上面的第一個技能——裂天一爪！",
    "只是對付一個還沒蛻變完成的傳奇，『裂天一爪』已經足夠了。",
    "他毫不猶豫的，催動了上面的技能。",
    "下一刻，一道巨大的蜥蜴虛影浮現！",
    "它的體型龐大到整個劍冢都無法塞下。",
    "身上時不時傳來一股巨大毀滅般的氣息。",
    "而女武神殘軀，此刻也陡然睜開了眼睛！",
    "目光死死地盯著那隻巨大蜥蜴的虛影，在其中，感受到了巨大的威脅！",
    "然而，那隻巨大的蜥蜴，已經抬起了右爪。",
    "那爪子如同擎天之柱，巨大而猙獰，鋒利的爪尖仿佛可以輕易地洞穿任何物體。",
    "並且在女武神殘軀的視線中，極速放大。",
    "這一爪快到了極致，曹星看到了前方幾千米的空間在這一爪下，出現了三道裂痕！",
    "然後，隨著一陣「咔嚓！咔嚓！」的碎裂聲。",
    "被這一爪，直接撕開了裂痕！",
    "包括前方的山體，以及那一名渾身燃燒著火焰的女武神，也被這一爪籠罩。",
    "【-152236273】",
    "一個足足九位數的傷害數字，從女武神殘軀的頭頂出現。",
    "而她那即將達到傳奇級別的氣息，也戛然而止……",
    "然後，曹星看到了，這個女武神的殘軀上，出現了三道裂痕，如燃燒的火雨般從天空中墜落。",
    "墜落在地上後，再也沒有爬起來。",
    "此刻，眾人看著前方的畫面，不由自主的咽了口口水。",
    "這一爪，不光是切開了劍冢，甚至還將整個山體都切開！",
    "從他們的視角，能看到劍冢外面的山體，和被積雪覆蓋的山林。",
    "呼嘯的寒風通過這幾道缺口倒灌了進來。",
    "換句話說，這一爪直接將這位劍聖留下的傳承之地，直接破開了。",
    "曹星感嘆道：「變態啊！真不愧是半神一擊！」",
    "「難怪這個技能上面的介紹說，會破壞地形……」",
    "「這要是對著永霜主城釋放，恐怕整座主城都會在這一擊下輕易覆滅了吧？」",
    "眾人的目光紛紛看向，摔落在地上的女武神殘軀。",
    "不得不說，她的肉身是真的恐怖！",
    "如果換成其他生物，早就在這一爪擊之下，被撕成了碎片。",
    "而她的身上，僅僅只是出現了三道裂痕。",
    "畢竟……這可是一尊死去的神靈殘軀……",
    "即使死去了，也有著無法想像的威能！",
    "眾人等待了許久，紛紛嚴陣以待。",
    "擔心這個女人會和上一次一樣，忽然再次復活，並且爆發出更加強大的力量。",
    "不過好在，他們足足等了三分鐘，地上的女武神殘軀依然沒有復活的徵兆。",
    "這也說明，對方真的徹底被他們幹掉了。",
    "然而，系統卻沒有傳來擊殺的提示。",
    "曹星眼中帶著疑惑之色，",
    "「奇怪了，怎麼沒有提示。難道是擊殺這種殘軀不給經驗值？」",
    "「還是說，對方依然沒有死去？」",
    "帶著疑惑之色，曹星上前探查了一下。",
    "在經過確認，這個女武神確實已經沒有了任何生氣。",
    "曹星臉上再次出現奇怪的神色。",
    "他又想到了另外一個問題。",
    "「特麼的，擊殺女武神殘軀不給東西就算了。」",
    "「不是說，擊敗劍冢中封印的生物，就能接受真正的傳承嗎？」",
    "正當曹星鬱悶不已，準備讓莎拉她們四處探查一番的時候。",
    "【倖存者請注意，你通過了所有考驗，劍聖傳承已開啟……】",
    "與此同時，一股神秘的力量落到身上。",
    "還沒等他高興多久，第二條系統提示出現。",
    "【因傳承者信息不符，你無法接受傳承的力量……】",
    "「傳承者信息不符，無法接受？」",
    "「這麼說，這個傳承真的是屬於衛劍一的？」",
    "「特麼的，這麼離譜？」",
    "畢竟，自己廢了這麼大的勁，甚至還用掉了兩枚珍貴的神力碎片，才幹掉了這個女武神。",
    "結果現在卻說，這個傳承是別人的。",
    "曹星眼中不斷閃過光芒，然後咬牙道。",
    "「特麼的，不能就這麼算了。」",
    "「莎拉，布隆，去搜查整個劍冢，把所有能帶走的東西全部帶走！」",
    "讓曹某人空手而歸，那是不可能的。",
    "更別說這一次，他還付出了巨大的代價。",
    "而就在這時，從那個巨大劍冢的殘骸之中，忽然飛出來一柄生鏽的鐵劍。",
    "這柄生鏽的鐵劍在空中發出一陣顫音，表面鐵鏽脫落，逐漸顯露出裡面光滑如新的劍身！",
    "一股神秘的光芒，從鐵劍中爆發，充斥整個劍冢，甚至讓人睜不開眼睛！",
    "隱隱約約中，曹星看到一道人影朝著眾人走來。",
    "他的身材高大挺拔，身著一襲古樸的青色長袍，長發隨意的束在腦後。",
    "腰間別著一把配劍，如同一名週遊天下的流浪劍客。",
    "【無名劍聖之影：？？？】",
    "看到信息，曹星差不多也明白了對方的身份。",
    "那名劍聖留下的虛影，也是這個傳承劍冢的掌控者。",
    "他先是看了看曹星，然後又看向地上的女武神殘軀，眼中浮現感慨之色。",
    "「沒想到，你居然斬殺了女武神的殘軀……真是不可思議……」",
    "曹星疑惑道：「不是說，要擊敗這個女人，才能開啟最後的傳承嗎？」",
    "「我擊敗她不是很正常？」",
    "對方緩緩搖頭道：「我留下女武神殘軀的目的，只是為了考驗傳承者的戰鬥力。」",
    "「然而，女武神的殘軀極其強大，在死亡後，她會激活體內的神力，短暫的擁有傳奇戰力。」",
    "「那個形態下的她，即使是我全盛時期，也難以對付。」",
    "「所有，我定下的規矩是，只需要擊敗她的第一形態，其實就相當於通過我的考驗了。」",
    "曹星眼中出現恍然之色。",
    "原來他並不需要斬殺女武神。",
    "這個女武神殘軀開啟第二形態後，這個劍聖虛影就會出現了。",
    "他繼續問道：「那我這算是通過考驗了嗎？」",
    "對方微微點頭，「通過了。」",
    "「不過……你也看得出來，我的這份傳承並不適合你。」",
    "曹星臉上出現遺憾之色，然後無奈道：「你也不在傳承上寫清楚，我還廢那麼大勁跟這個女武神交戰。」",
    "「我的損失很大的，你知道嗎？」",
    "聽到這話，這道虛影臉上出現歉意的神色。",
    "「非常抱歉，這確實是我的疏忽。」",
    "「我也沒想到，一個法師會通過我的劍聖傳承……」",
    "他神色複雜的看著曹星。",
    "自己設定的所有傳承條件，都是用劍，其他職業甚至連第一道門都過不去。",
    "但是現在，硬生生被一個法師通過了所有條件，這特麼找誰說理去。",
    "片刻後，他忽然想起了什麼，然後說道：「不過，我倒是可以送你一樣禮物，作為補償。」",
    "那名劍聖虛影看向旁邊的女武神殘軀，說道：「你可以把她帶走。」",
    "曹星微微一愣，「帶走女武神的殘軀？」",
    "「她不是死了嗎？我帶走有什麼用。」",
    "這名劍聖虛影輕笑道：「她是死了，但是你也看得出來，她的殘軀中有一股神奇的力量。」",
    "「這股力量讓她即使死去，也能發揮出驚人的戰鬥力。」",
    "「我當時就發現了這一點，於是冒著隕落的危險，在那片神隕之地帶回了她的殘軀，然後將其埋在了劍冢之中。」",
    "「長期以各種劍氣孕育，她的殘軀上誕生了一抹神識。」",
    "「這抹神識純淨而空靈，她沒有任何記憶，相當於一個初生的嬰兒。」",
    "曹星似乎意識到了，不確定的問道「你的意思是……」",
    "劍聖的虛影說道：「正如你想的那樣。」",
    "「你剛剛泯滅了她的所有意識。」",
    "「換言之，現在這具女武神殘軀上面，可以誕生出新的神識，然後你可以為她灌輸記憶。」",
    "「如此一來，她將會百分百服從於你，成為你最忠誠的戰士。」",
    "聽到這話，曹星哪還不明白這道劍聖虛影話里的意思。",
    "自己可以讓這尊女武神殘軀復活，並且聽從自己的命令行事！",
    "想到這裡，他的呼吸都有些急促了起來！",
    "畢竟，這個女武神的強大，曹星已經深有體會。",
    "如果能讓其復活，並且成為自己的戰力，那麼自己不僅會再多出一個底牌，同時領地的實力也將暴漲一大截！"
  ],
  "updatedAt": "2026-06-25T04:03:59.000Z"
}