{
  "novelId": "global-descent",
  "chapterNo": 290,
  "sourceLang": "cn",
  "targetLang": "cn",
  "title": {
    "source": "第290章",
    "translated": "ตอนที่ 290"
  },
  "status": "source",
  "paragraphs": [
    "驚恐的掠奪者首領，人頭懸賞（6600）",
    "通道盡頭，有著一座寬敞的洞窟。",
    "裡面依靠著山體，建造了各種哨塔，二三層的平台等等。",
    "這裡面聚集了數百名雪地掠奪者。",
    "而在中心區域，一個二層的平台上。",
    "一尊身形極其魁梧，甚至跟布隆不相上下，面容粗獷的男人，端坐在獸皮椅子上。",
    "而在其旁邊，則是大量的雪山掠奪者。",
    "在他面前，那個肩膀還在流血的掠奪者頭目跪在地上，對著獸皮大椅上的強壯男性說道。",
    "「首領大人，情況就是我跟您說的那樣，那群人極其強大，光一個刺客，我就感覺比您還要強悍！」",
    "「他們不知道是怎麼找到我們營地位置的，但是，這些傢伙已經打上來了。」",
    "這位身上穿著厚厚的獸皮大衣，表情平淡的壯漢淡淡的瞥了他一眼。",
    "「他們是如何找到我們營地位置的，你還不清楚嗎？」",
    "而跪在地上的這名頭目，則是神色茫然。",
    "坐在椅子上的壯漢繼續說道：「薩維奇，你要知道，如果是在我的手中，你將不會有任何逃脫的機會。」",
    "「而你能從那名比我更強的刺客手中逃走，並且回到我們的領地，這代表什麼你應該知道吧？」",
    "聽到這話，地上的頭目也猛然意識到了什麼。",
    "「該死的！她們是故意把我放走的，目的就是要找到我們的營地！」",
    "然後，他的眼中出現了驚恐之色！",
    "「首領大人，我不是故意的……我不知道自己被跟蹤了，請您原諒！」",
    "這名頭目不住的磕著響頭，乞求自己首領的原諒。",
    "而坐在上面的男人輕笑道：「不用慌張，我已經知道他們的打算了。」",
    "「不過，想打我們營地的主意，可沒那麼簡單。」",
    "「我已經派人過去截殺他們，並且路上也布置了大量的陷阱。」",
    "「這些傢伙還沒過來，路上就得死一半人。」",
    "「到時候，他們要是敢進來，我們幾百號人一擁而上，哪怕這些傢伙比我強，也要全部折在這裡！」",
    "聽到這話，地上的那名頭目眼中的驚恐之色也逐漸消散。",
    "他連忙說道：「首領大人真是料事如神，有您在，我們的營地就是鐵桶一片，絕不會被人攻陷！」",
    "而就在這時，一個掠奪者緊張的衝過來說道：「首……首領大人，大事不好了！」",
    "「那群人類，打進來了！」",
    "坐在獸皮大椅的掠奪者首領聽罷淡淡的說道：「慌什麼？」",
    "「那群人類傷亡情況如何？」",
    "而這名掠奪者猶猶豫豫的說道：「沒……沒有任何人受傷……」",
    "掠奪者首領聽罷，也有些驚訝的說道：「沒有受傷？那些陷阱沒有攔住他們？」",
    "「是的，首領大人，那些陷阱全部被拆了！」",
    "「還有您派出去的弓箭手，也全部被擊殺了！」",
    "聽到這話，這個首領神色微微一驚。",
    "然後連忙道：「快，馬上去倉庫里，把那樣東西取出來！」",
    "話音剛落，忽然感應到通道入口傳來一陣巨響！",
    "幾個掠奪者，便被猛地撞飛出去！",
    "一道赤裸著上半身，身形魁梧壯漢，如同推土機般沖了進來!",
    "「啊哈！這裡還藏了好多老鼠！」",
    "「領主大人，找到啦！」",
    "下一刻，曹星一行十餘人，從身後的通道中鑽了進來。",
    "霎時間，便看到了前方出現了一個寬敞的洞窟。",
    "裡面燃燒著明亮的篝火，牆邊也插滿了火把。",
    "沿著牆體，他們建造了許多個平台。",
    "上面站著大量的雪地掠奪者，他們紛紛手持弓箭，拉開了弓弦。",
    "這時候，那個雪山掠奪者頭目頓時驚呼道：「里貝羅首領，就是這些傢伙！」",
    "「快下令讓兄弟們幹掉他們，我要讓他們付出代價！」",
    "曹星神色微動，因為他也看到了這個營地裡面的人數。",
    "粗略估計，至少有四百多人。",
    "其中還有一百多個弓箭手，這些弓箭手如果一波集火的話，哪怕是五階統帥級生物也吃不消。",
    "而曹星倒也並沒有慌亂。",
    "他這邊生存能力太強了。",
    "維多利亞的【念氣罩】，伊莎貝爾的【新生聖歌】，都能保證眾人面對集火而不死。",
    "那個雪山掠奪者首領沒有第一時間下令攻擊。",
    "他明顯感覺到，眼前這群人不好惹。",
    "「首領大人，快下令把這幾個傢伙幹掉啊！」",
    "「那個暗精靈刺客太靈活了，要是被她跑了就麻煩了！」",
    "見這個頭目還在喋喋不休。",
    "首領呵斥道：「給我閉嘴！」",
    "如同一頭猛虎的聲音在他耳邊響起，直接嚇得他癱軟在地上。",
    "「首…首領大人，您怎麼了？」",
    "「您不是說，我們幾百號人一擁而上，就可以把他們全部幹掉嗎？」",
    "而此時，那名首領掠奪者卻臉色僵硬。",
    "因為他在曹星等人的身上，感受到了一股致命的危機感。",
    "但給他們的感覺，卻如同面對千軍萬馬！",
    "不僅如此，場上至少有七八個都給他一種極度危險的感覺。",
    "尤其是那個手持雙刀的女人，還有那名騎士。",
    "他神色僵硬，然後的說道：「幾位勇士，實在不好意思，我這幾個不長眼的部下冒犯了你們。」",
    "「多有得罪，我替他們向你們道歉。」",
    "這個看起來壯如蠻牛般的傢伙，使自己的語氣儘量平和。",
    "而聽到這話，整個營地中的空氣一滯。",
    "那些雪地遊獵者眼神震撼的看著自己的首領。",
    "因為他們知道，自己的首領說出這番話的時候，就代表他已經服軟了！",
    "而此時，曹星聽到這話卻笑道：「你搞錯了，冒犯我們的那些傢伙已經全部被我幹掉了。」",
    "「我們來這裡，只是拿點東西而已。」",
    "這名雪地掠奪者首領聽到這話，臉色緩和了起來。",
    "他自然是聽懂了曹星的意思。",
    "「原來是這樣，那倒是好說。」",
    "「幾位，你們想要什麼，不管是酒水布匹，還是寶石珠寶，我都可以給你們。」",
    "「如果你們要女人，等我一段時間，我也可以給你們帶來。」",
    "而曹星卻說道：「我不是這個意思。」",
    "「我是說，你把倉庫打開，然后里面的所有歸我。」",
    "「包括你們這些傢伙的人頭在內。」",
    "聽到這話，場上所有掠奪者頓時氣急。",
    "「囂張！真是欺人太甚！」",
    "「這些傢伙根本就沒想著談判！」",
    "「首領大人，我們一起動手，把這些傢伙全部幹掉吧！」",
    "「沒錯，他們就十幾個人，我們可是幾百號人，一人一刀就能把他們砍得渣都不剩了！」",
    "說完，平台上面的弓箭手已經全部拉開了弓弦。",
    "其中還有不少人手裡拿著地精炸彈，準備向著曹星他們丟來。",
    "而下方的那些掠奪者，則是緩緩聚集在一起，準備一窩蜂對曹星他們展開衝擊。",
    "那名掠奪者首領，臉色則是陰晴不定。",
    "他比自己的這些手下都更加清楚，眼前這群人類的可怕。",
    "如果可以的話，付出點代價，讓他們離開是最好的事。",
    "然而，以那個年輕人的語氣，這件事似乎沒辦法善了了。",
    "他再次試探著問了一句，「沒有任何商量的餘地？」",
    "「沒有。」曹星攤了攤手。",
    "聽到這話，這名雪山掠奪者首領也是放棄了最後的希望。",
    "他深吸一口氣，然後說道：「那就手底下見真章吧！」",
    "「一起上，幹掉他們！」",
    "得到命令，那些雪山掠奪者頓時舉起武器。",
    "「殺啊！幹掉這些傢伙！」",
    "「我要把他們的手腳砍下來，掛在頭頂上！」",
    "「那個囂張的人類法師歸我，我要他跪在地上求饒！」",
    "前方，大量的雪山掠奪者朝著他們衝來。",
    "頭頂上，一道道箭矢朝著激射而出！",
    "眾人耳邊響起了大量的破空聲。",
    "與此同時，維多利亞威嚴的聲音響起。",
    "念氣罩再次出現，擋住了那些箭矢的攻擊！",
    "面對集火，維多利亞的念氣罩耐久度如同流水般傾瀉。",
    "曹星不慌不忙的下令道：「蕾妮斯，希兒妲，伊莎貝爾，你們去對付上面的傢伙。」",
    "「莎拉，你去幹掉那個首領，還有他身邊的頭目。」",
    "話落，莎拉便如同一條毒蛇般，沖了出去！",
    "蕾妮絲和伊莎貝爾等遠程單位，也紛紛發出了攻擊。",
    "各種恐怖的群攻，落在那些二三層的平台上，激起一片密密麻麻的傷害。",
    "眨眼間，平台上那些弓箭手的陣型就被衝散。",
    "而此時，眼前至少有一兩百個雪山掠奪者，手持刀槍棍棒，朝著他們衝來。",
    "其中還有幾個手裡拿著地精炸彈，準備丟過來炸他們。",
    "阿薩姆等人剛準備衝出去攔下這些傢伙。",
    "曹星忽然說道：「等一下，讓我來。」",
    "話落，他雙手往地上一按。",
    "一股恐怖的寒氣從他手掌中迸發而出！",
    "地面上，瞬間出現了大量的冰霜。",
    "然後，這股冰霜如同一條冰雪跑道一般，向著前方迅速蔓延！",
    "正是他的史詩級技能——千里冰封！",
    "而且，因為手上的史詩法杖【百寒】特效。",
    "這一招的範圍擴大了30%",
    "直接從腳下，蔓延到了洞窟的盡頭。",
    "前方衝來的一百多個雪山掠奪者被這招【千里冰封】籠罩，移動速度爆降一大截！",
    "下一刻，大量的寒冰碎片迸發而出，攻擊了場上所有的掠奪者。",
    "密密麻麻的傷害數字飄起，所有雪山掠奪者的血量下降了至少三分之一。",
    "而裡面的敵人突遭攻擊，頓時滿臉驚恐！",
    "「這是什麼魔法？好大的範圍！」",
    "「不知道，不要在這裡待著，我們快衝出去！」",
    "話落，那些掠奪者就準備分散逃跑。",
    "而此時，曹星繼續下令道：「維多利亞，聚能衝擊波！」",
    "維多利亞早已經撤去了【念氣罩】，雙手之間開始凝聚大量的念氣。",
    "聽到曹星的命令後，她伸出白皙的雙手，向著前方猛然一推！",
    "下一刻，一道長度超過五米，直徑超過兩米恐怖的念氣波出現。",
    "如同一顆巨大的炮彈，向著前方瞬間衝去！",
    "所有被攻擊到的雪山掠奪者，頓時如同自己被一堵牆壁砸中，渾身骨頭斷裂，爆吐出一口鮮血！",
    "一道道比之曹星更加強悍的傷害數字出現。",
    "經過了三秒蓄力，維多利亞的【聚能衝擊波】，傷害來到了一個恐怖的程度！",
    "前方，至少幾十個雪山掠奪者進入了殘血狀態。",
    "然後，曹星下令道：「伯捷，落日餘暉接屠龍戰斧。」",
    "這位龍血鬥士統帥，接受到曹星的命令後，沒有絲毫猶豫。",
    "從他那瘦小的身上，迸發出了一股堪稱浩瀚的氣息！",
    "「所有墮落者啊，見識這末日世界的太陽，最後的餘暉吧！」",
    "這片封閉的洞窟中，居然出現了一個血紅的太陽！",
    "這顆太陽散發著扭曲的紅色氣息。",
    "所有敵人的護甲瞬間下降20%！",
    "不僅如此，伯捷的巨斧上，都攜帶了這種扭曲的紅色氣息！",
    "[你的領地成員：伯捷·逐日者使用了統帥級技能【落日餘暉】，攻擊速度、移動速度增加100%，攻擊範圍增加50%，受天賦【永恆之力】影響，該技能已變為永久狀態！]",
    "（註：永久狀態下，可隨時退出與關閉。）",
    "看到系統提示，曹星嘴角也出現了一抹笑容。",
    "這個強大的統帥級技能也變成永久了，雖然會有每秒1%的生命流失副作用，但他的恢復能力更加強悍，直接抵消了這個效果。",
    "不等那些雪山掠奪者反應過來，伯捷向著前方猛然一斧斬去！",
    "前方，陡然出現一道巨大的紅色氣流！",
    "這道氣流與那些雪山掠奪者的身體接觸的瞬間，便輕易的劃開了他們的皮膚。",
    "而且隨著距離推進，這道血色氣流範圍越來越大！",
    "然後，這些雪山掠奪者便如同收割的麥子般，成群的倒了下去。",
    "【你的領地成員：伯捷·逐日者擊殺了雪山掠奪者lv39，四階普通生物，越級殺怪，獲得經驗值：1560*3】",
    "【你的領地成員：伯捷·逐日者擊殺了雪山掠奪者lv40，四階普通生物，越級殺怪，獲得經驗值：1600*3】",
    "瞬間，從他的身體中，接連升起兩道白光！",
    "伯捷直接當場升了兩級，屬性獲得了不小的提升。",
    "他似乎明白了曹星的用意，感激的說道：「多謝領主大人！」",
    "【因你的幫助，領地成員：伯捷·逐日者忠誠度小幅度提升，當前忠誠度：80】",
    "曹星笑了笑：「繼續吧，幹掉這些傢伙。」",
    "此刻，在【落日餘暉】狀態下，伯捷的攻速和移速暴增，並且感受不到疼痛。",
    "這使他此時戰鬥起來，簡直像一個狂暴的野獸。",
    "巨斧不斷落下，每次攻擊，都如同炸彈爆炸！",
    "再加上，旁邊的布隆和阿薩姆也沖了出去。",
    "「啊哈！小老鼠們，布隆來啦！」",
    "他手持巨大的盾牌，將一個個雪山遊獵者撞飛在一起。",
    "然後回頭說道：「阿薩姆騎士，靠你了。」",
    "阿薩姆輕笑道：「沒問題。」",
    "話落，他手持【亞隆迪吉特】，直接一道【霜狼劍氣】斬去。",
    "至少十幾個雪地遊獵者被這道劍氣掃過，頭上出現一個個恐怖的傷害。",
    "霜狼劍氣166%的傷害劍術，加上阿薩姆100%的暴擊率。",
    "他現在的傷害，已經達到了堪稱恐怖的程度。",
    "瞬間，這十幾個雪地遊獵者便被當場擊殺！",
    "【你的領地成員：阿薩姆擊殺了雪山遊獵者lv39，四階普通生物，獲得經驗值：1560】",
    "【戰鬥人員獲得經驗值：780】",
    "而曹星下令道：「阿薩姆，尋找角度使用神光劍氣。」",
    "這個特效一天只能用一次，正好這裡的敵人數量夠多，一波下去也能增加不少攻擊力。",
    "阿薩姆說完，騎著霜狼就脫離了戰場。",
    "在曹星身後，念氣女皇維多利亞和【梟獸形態】的安德魯，不斷發出各種遠程攻擊。",
    "包括曹星自己，也在抬起法杖，釋放一個個法術，造成恐怖的傷害。",
    "在眾人的狂轟濫炸之下。",
    "眼前的這些雪地掠奪者，便出現了大量的殘血。",
    "某個角落中，阿薩姆高高舉起湖女之劍，然後喝道：",
    "「謹以女神克米爾之名，對你們降下制裁！」",
    "話落，一道長達百米的巨大劍氣，帶著無邊的威勢掃過！",
    "阿薩姆頭頂的山體被切出一道恐怖的劍痕。",
    "至少一百多個雪山掠奪者，被這一道劍氣籠罩。",
    "頭上均出現了一個個恐怖的傷害。",
    "沒有一個傷害低於三萬！",
    "神光劍氣326%的傷害係數，加上100%的暴擊率，造就了這恐怖的一劍！",
    "被命中的那些雪山掠奪者，一些人當場被劍氣蒸發。",
    "還有一些人，身體直接被斬成了幾段，死得不能再死。",
    "【你的領地成員阿薩姆，成功使用神光之劍，擊殺了117名敵人，亞隆迪吉特武器攻擊力增加117點……】",
    "看到系統提示，曹星嘴角勾出了一抹笑容。",
    "當劍氣消散，所有人都帶著驚恐的神色，看著這名如同殺神一般的騎士！",
    "一劍，幹掉了他們一百多個同伴，這幾乎是整個營地三分之一的數量！",
    "這個騎士的攻擊力，到底有多恐怖？",
    "而且更關鍵的是，從戰鬥開始到現在，他們已經死了快一半的人了。",
    "而對面，不僅一個都沒死，而且看起來毫髮無損的樣子。",
    "這直接讓場上的雪山掠奪者，心中升起了一抹寒意。",
    "然而，他們發呆，曹星可不會發呆。",
    "「楚楚，召喚空戰機器人，去對付上面的傢伙。」",
    "此刻，上方的那些弓箭手，也被蕾妮斯和希兒妲等遠程打得抱頭鼠竄。",
    "童楚楚聽罷，直接召喚出一台空戰機器人——狂風！",
    "這台體型達到一米，渾身看起來充滿了厚重感的機器人，胸口的能源核心瘋狂轉動。",
    "帶著強烈的威勢，直接飛到了空中。",
    "然後，它的後背彈藥儲存位置一陣顫動。",
    "直接就是十幾顆彈藥噴射出來。",
    "劇烈的爆炸實現了大面積的火力覆蓋。",
    "直接將不少弓箭手從平台上轟了下來。",
    "狂風機器人靈活的在空中飛行，背上不斷噴出炸彈，摧毀那些二三層的小平台。",
    "旁邊的埃麗莎見此情景眼睛一亮，盯著童楚楚說道：「小楚楚，你的機器人好厲害，它居然會飛！」",
    "「能不能帶我一起飛到天上去？」",
    "而童楚楚卻搖了搖頭說道：「埃麗莎姐姐，機器人只能存在幾分鐘時間，它還要戰鬥，是不能帶著你飛到天上去的。」",
    "聽到這話，埃麗莎眼中出現失望的神色。",
    "而此時，洞窟中的掠奪者已經越來越少。",
    "在曹星這邊的單方面蹂躪下，慘叫聲此起彼伏。",
    "「首領大人！救我啊！」",
    "「啊！這些傢伙都是怪物，我們根本打不過他們！」",
    "他們呼喚著自己的首領。",
    "然而，那名首領，以及旁邊的兩個五階頭目，此時也正在被莎拉一人全方面的壓制。",
    "他揮舞手中那把巨大的錘子，朝著莎拉猛地砸來！",
    "劇烈的塵土飛揚，地面直接被他砸出一個大坑！",
    "這傢伙的威勢，看起來比伯捷還要驚人。",
    "感覺這座洞窟都要被他砸塌陷了。",
    "而在旁邊，一個手持長劍，另一個手持戰刀的頭目，也在不斷地對莎拉展開攻擊。",
    "然而，莎拉只是淡淡的瞥了他們一眼，靈活的躲過了三人的一次次攻擊。",
    "並且一個【弧光閃】就出現在了掠奪者首領的背後。",
    "短刀在他背上划過，留下一個個恐怖的傷害。",
    "掠奪者首領背後吃痛，爆吼一聲。",
    "「該死的暗精靈！我要把你砸成肉泥！」",
    "然而，任由他如何發怒。",
    "莎拉靈活的身姿，就是讓他連衣角都摸不到。",
    "曹星也注意到了莎拉那邊的戰況，然後掃了這個首領一眼。",
    "【雪山掠奪者首領：里貝羅】",
    "【等級：46級（五階首領級生物）】",
    "【血量：258129/418345】",
    "【攻擊力：5831~5982】",
    "【護甲：873~912】",
    "【技能：高級戰錘精通（使用戰錘類武器戰鬥時，力量增加30%，暴擊率+20%）",
    "粉碎（揮舞巨錘，朝著前方猛然砸去，對10米區域內的敵人造成188%的重擊傷害，並使其陷入1~3秒眩暈狀態，冷卻時間：30秒）",
    "招架（使用巨錘招架敵人的攻擊，減少80%受到的傷害）",
    "繳械（攻擊時，有50%概率，打掉敵人的武器，使其進入繳械狀態）",
    "大錘轉轉轉（里貝羅進入高速旋轉狀態，可一邊移動一邊揮舞巨錘，將周圍的所有敵人擊飛，並且造成178%的傷害，持續時間15秒，冷卻時間：120秒）】",
    "【天賦：力大無窮（力量屬性+30%）】",
    "（介紹：里貝羅曾經是奧利戈維奇公爵手下的一員大將，但因為無法控制體內的力量，在陪同公爵的小女兒玩耍的時候，不小心將她的腦袋當成西瓜捏碎，這一幕讓當時的眾人都處於茫然狀態。",
    "知道自己犯下罪行的里貝羅，立即反應過來，並且殺光了當時在場的所有人，然後連夜逃離了永霜主城，此後，他受到了整個冰晶王國的通緝。",
    "若你能將其擊殺，並將他的隊長印章帶到永霜主城，可領取豐厚的獎賞。）",
    "看到上面的人物介紹，曹星愣了一下。",
    "「哦？這傢伙，身上還背著一條懸賞？」",
    "（PS：今天還是一萬三更新，明天就是收穫時刻了，小作者正在全力碼字中！）"
  ],
  "updatedAt": "2026-06-25T04:03:59.000Z"
}