{
  "novelId": "global-descent",
  "chapterNo": 127,
  "sourceLang": "cn",
  "targetLang": "cn",
  "title": {
    "source": "第128章"
  },
  "status": "source",
  "paragraphs": [
    "第128章 盾牌神殿，曹星的戰術指揮！",
    "盾牌神殿之外，似乎已經被大量的噬魂怪占據了。",
    "幾十隻噬魂怪在神殿外面不斷爬行的場景，讓曹星感到震撼不已。",
    "「我去……這麼多？」",
    "曹星心中驚訝的同時也感覺到一股壓力。",
    "除了那些普通的噬魂怪，他在怪群中，甚至還看到了一兩隻有著紅色皮膚和黃色皮膚的噬魂怪。",
    "它們直立行走的模樣，看起來更像是電影裡的異形。",
    "掃了一眼這些怪物的屬性。",
    "【噬魂怪嚎叫者（lv25）】",
    "【種族：噬魂怪】",
    "【等階：三階精英級】",
    "【生命值：18940/18940】",
    "【攻擊力：1077~1112】",
    "【技能：靈壓，散魂之爪，噬靈（屬性同上）",
    "噬魂嚎叫（發出刺耳的叫聲，使周圍所有噬魂怪陷入狂暴狀態，攻擊速度加快30%）】",
    "【天賦：噬靈之體】",
    "…",
    "【噬魂怪潛行者（lv27）】",
    "【種族：噬魂怪】",
    "【等階：三階精英級】",
    "【生命值：17680/17680】",
    "【攻擊力：1205~1244】",
    "【技能：靈壓，散魂之爪，噬靈（屬性同上）",
    "潛行爪擊（潛入陰影中，下次出現時，對敵人造成217%的傷害，冷卻時間180秒）】",
    "【天賦：噬靈之體】",
    "…",
    "「好厚的血量。」曹星瞳孔一縮。",
    "然而，除了這兩隻精英級別的噬魂怪。",
    "旁邊還有一隻體型超過五米長，黑漆漆的大口張開，仿佛能把人一口吞掉的巨型噬魂怪！",
    "這才是這群噬魂怪中，最強的存在！",
    "【噬魂怪撕裂者（lv28）】",
    "【等階：三階頭目級生物】",
    "【血量：31240/31240】",
    "【攻擊力：1519~1540】",
    "【技能：靈壓，散魂之爪，噬靈（屬性同上）",
    "魔爪橫掃（撕裂者橫向揮舞利爪，對敵人造成兩段157%的傷害，並使其陷入殘廢狀態，冷卻時間120秒）",
    "惡靈噬咬（撕裂者抓住敵人，展開瘋狂的撕咬，對其造成多段傷害，並且恢復自身血量，冷卻時間500秒）】",
    "【天賦：噬靈之體】",
    "…",
    "「恐怖的傢伙！」曹星評價道。",
    "他沒有第一時間讓手下們衝進去，而是繼續觀察裡面的情況。",
    "此刻，那些噬魂怪正在鍥而不捨的攻擊大門。",
    "然而每次都會被大門上面的藍色能量護盾彈開。",
    "不過。似乎因為這些噬魂怪不斷攻擊的原因，大門上的能量護盾已經愈發薄弱。",
    "曹星思索道：「這應該就是亡靈卡爾漢說的高級魔能大門了，將這群噬魂怪擋在了外面。」",
    "「不過，這個大門好像快撐不住了。」",
    "掃了一眼大門的屬性。",
    "【高級魔能大門】",
    "【護甲：500】",
    "【耐久值：200000】",
    "【護盾耐久值：34032/100000（每秒回復1000點耐久值，消耗5點能量）】",
    "【剩餘能量：1032/50000】",
    "…",
    "曹星暗自點了點頭。",
    "果然跟自己預料的那樣，大門快撐不住了。",
    "等護盾能量消耗殆盡，然後就可以攻擊大門本體。",
    "再之後，那群噬魂怪就可以沖入盾牌神殿，開啟自助餐環節。",
    "這時候，那些手下們也看到了裡面的場景。",
    "布隆壓低了聲音，驚嘆道：「諸神在上！好多怪物！」",
    "聽到他的聲音，其他手下們也紛紛走了過來，看到了裡面的場景。",
    "頓時心中一驚。",
    "蕾妮絲也驚訝不已：「好多的噬魂怪！」",
    "一時間，眾人心中都感覺到了一股壓力。",
    "他們雖然很強，但這裡的三階噬魂怪太多了。",
    "再加上二階和三階的差距。",
    "如果被圍攻的話，哪怕是他們也頂不住。",
    "曹星打了個手勢，讓所有人慢慢後撤。",
    "在通道中，眾人迅速聚集在一起。",
    "然後，所有的目光都看向了曹星。",
    "雖然曹星只是個二階的法師，但通過前面幾次的戰鬥，他的指揮能力已經獲得了眾人的認可。",
    "哪怕是莎拉，也十分佩服他的指揮能力。",
    "這些招募生物們都在等待著曹星發布命令。",
    "曹星也在思索，似乎在思考戰術。",
    "這時候，他抬頭看向旁邊的莎拉，然後問道：「莎拉，那兩隻精英級噬魂怪，外加那隻頭目一起交給你，有把握嗎？」",
    "莎拉點了點頭：「我的利刃，將受你驅使，斬斷一切荊棘！」",
    "她顯得自信十足。",
    "莎拉雖然是剛剛進階的三階首領，跟這些噬魂怪差了幾級。",
    "但她那豐富的戰鬥經驗，以及曹星為她附加的一系列BUFF，可以說是不管是生存能力還是攻擊能力，都強悍到恐怖。",
    "曹星點頭道：「好，那就這樣。」",
    "「接下來，莎拉先發動攻擊，然後負責將那三隻噬魂怪引走，脫離戰場。」",
    "「而我們，要吸引其他噬魂怪的注意力，讓它們全部過來攻擊我們。」",
    "「而布隆和阿薩姆，你們要一起守住大門。」",
    "「然後所有遠程單位，開始全力輸出。」",
    "這是很簡單的卡門戰術。",
    "不過，因為他們面前的大門很寬，所以至少需要兩名強大的戰士才能擋住",
    "而且這個戰術最關鍵之處在與，莎拉能夠成功將那三隻強大的噬魂怪引出戰場。",
    "同時，負責堵門的阿薩姆和布隆，要死死地擋住外面噬魂怪的攻擊，絕不能把噬魂怪放進來。",
    "於是，曹星將背包中的【生命秘藥（小）】掏出來。",
    "然後給布隆，阿薩姆，安德魯，莎拉每人分了5瓶。",
    "曹星說道：「一會，伱們四個將承擔大部分的壓力，一定要聽我的指揮行事。」",
    "阿薩姆率先回應，「遵從領主大人的命令，我相信，您將和以前一樣，帶領我們贏得勝利！」",
    "一旁的安德魯也彈出了利爪，「您是位充滿了智慧的領主，大自然的力量將受你驅使。」",
    "曹星點了點頭。",
    "然後，他直接道：「那麼現在，行動開始！」",
    "「莎拉，去吧！」",
    "曹星話落，莎拉已經從陰影中消失。",
    "她進入了潛行狀態，直接進入了通道外面的大廳中。",
    "而那群噬魂怪，似乎完全沒有察覺。",
    "曹星帶著手下們默默的等待著。",
    "所有人都屏住了呼吸。",
    "幾秒之後。",
    "那隻頭目級怪物：噬魂怪撕裂者背後忽然出現了一道血痕。",
    "一抹寒光無聲無息的划過。",
    "【-3754！】",
    "下一刻，一個恐怖的傷害數字出現。",
    "噬魂怪撕裂者受到攻擊，頓時仰天嘶鳴。",
    "「嘶！！！」",
    "尖銳的鳴叫聲，讓整個噬魂怪群也一陣騷動。",
    "咚！咚咚咚！",
    "噬魂怪群雜亂的腳步聲，似乎想尋找攻擊它們的敵人。",
    "然而，任它們怎麼尋找，也沒有找到",
    "在【陰影綻放】狀態下，莎拉即使發出攻擊，也不會從潛行狀態退出。",
    "而就在這時，另外兩隻精英噬魂怪身上，同樣出現了一道血痕。",
    "【-2314】",
    "【-2251】",
    "兩個恐怖的傷害數字出現。",
    "「嘶！嘶嘶！」",
    "精英噬魂怪們同樣發出憤怒的嘶鳴。",
    "整個怪群開始了更加嚴重的騷亂。",
    "與此同時，莎拉三次攻擊後，從【陰影綻放】狀態下退出，逐漸顯出了身形。",
    "而那群噬魂怪，也看到了大廳角落處的一道陰影。",
    "噬魂怪撕裂者頓時通紅著眼睛，",
    "「嘶！」",
    "下一刻，所有噬魂怪如同一群發狂的異形，朝著莎拉猛然撲去。",
    "「轟隆！轟隆隆！」",
    "幾十隻噬魂怪撲過去的場面十分驚人。",
    "而就在這時，曹星開口道：「蕾妮絲，希兒妲，攻擊！」",
    "「阿薩姆，沖入怪群中，吸引所有噬魂怪的注意力！」",
    "曹星話落。",
    "阿薩姆如同一名出征的騎士，高舉著長劍瞬間沖了出去。",
    "而蕾妮絲和希兒妲，也同時做出了攻擊動作。",
    "此刻，那群噬魂怪看到身後又有一道身影衝來，注意力頓時被這邊吸引。",
    "「嘶嘶！嘶嘶！」",
    "一部分噬魂怪朝著阿薩姆衝來。",
    "曹星在後方下令道：「阿薩姆，使用正義之劍！」",
    "阿薩姆聽罷沒有絲毫猶豫，直接高舉起手中的騎士之劍，一股神聖的光芒凝聚。",
    "「以正義之名，斬！」",
    "唰！唰唰唰！",
    "【-335】",
    "【-347】",
    "【-384】",
    "【-594！】",
    "【-317】",
    "……",
    "至少十幾隻噬魂怪被阿薩姆這一波劍氣掃飛！",
    "然而，這群怪物在落地之後，以更兇殘的的姿態朝著阿薩姆猛然撲來。",
    "並且就連追擊莎拉的噬魂怪，也有一部分沖了過來。",
    "看到這一幕，曹星直接下令道：「阿薩姆，回來！」",
    "「蕾妮絲，希兒妲，繼續攻擊莎拉旁邊的噬魂怪，把所有噬魂怪都吸引過來！」",
    "得到曹星的指令後。",
    "蕾妮絲瞬間調整了射箭的角度。",
    "咻！",
    "【-478！】",
    "第一根箭矢剛剛射出，緊接著再次射出第二箭。",
    "而希兒妲也開始噴吐成片的血毒。",
    "落在那群噬魂怪身上，發出成片『嗤嗤』的響聲。",
    "噬魂怪吃痛，發出一陣陣痛苦的嘶鳴聲。",
    "越來越多的噬魂怪朝他們沖了他們。",
    "而曹星看到，還是有一部分噬魂怪沖向了莎拉，頓時目光一凝。",
    "「阿薩姆，回頭，斬出一道霜狼劍氣。」",
    "阿薩姆此時正在朝通道中狂奔過來，得到曹星的指令。",
    "他瞬間停下了腳步，然後一股冰霜氣息，在他的長劍中凝聚，",
    "「唰！」",
    "一道藍色的劍氣豎著斬過，落入了莎拉那邊的怪群中，激起密密麻麻的傷害數字。",
    "然而，阿薩姆的這一劍，徹底吸引了所有噬魂怪的注意力。",
    "包括兩隻精英，一隻頭目噬魂怪也全部朝著眾人湧來。",
    "看到這一幕，一旁的姬心月瞬間心臟揪緊。",
    "因為這跟曹星的戰術安排不一樣，",
    "如果不把那些精英和頭目引走的話，他們這邊將會承受極大的壓力。",
    "說不定會被衝散陣型，然後全員被噬魂怪撕碎！",
    "然而，曹星似乎並沒有慌亂。",
    "他對著莎拉打了個手勢。",
    "黑暗中的莎拉會意，然後打了個響指。",
    "「啪！」",
    "下一刻，三隻噬魂怪突然如遭雷擊。",
    "【-3754】",
    "【-2314】",
    "【-2251】",
    "三個恐怖的傷害從它們的頭上出現。",
    "這是莎拉的【陰影綻放】技能，可以記錄之前攻擊的傷害，然後引爆造成全額傷害，相當恐怖！",
    "但可惜的是，這個技能有五分鐘的冷卻時間。",
    "此刻，三隻噬魂怪遭受重創，終於徹底被莎拉吸引了仇恨。",
    "它們脫離戰場，朝著莎拉就沖了過來。",
    "而莎拉也毫不畏懼，站在原地對著這三隻噬魂怪，就做出了挑釁的動作。",
    "曹星看到這一幕，心下大定。",
    "「很好！噬魂怪終於被分開了！」",
    "幾十隻普通噬魂怪朝著他們沖了過來。",
    "而曹星頓時下令道。",
    "「布隆，架盾！」",
    "「阿薩姆，幫助布隆全力防守！」",
    "下一刻，兩個大塊頭將通道大門死死的堵住！",
    "而那些噬魂怪也瘋狂的沖了上來。",
    "「嘶！嘶嘶嘶！」",
    "它們一邊發出刺耳的嘶鳴聲，一邊用它們那鋒利的鉤爪對阿薩姆和布隆造成攻擊！",
    "「咔嚓！咔嚓！」",
    "一陣陣碎裂聲傳來。",
    "二人身上的三層聖盾被大量的噬魂怪撕碎。",
    "緊接著，柳慕雪盾牌上的特效，【騎士之佑】也被擊潰。",
    "下一刻，他們頭上出現了一個個傷害數字。",
    "【-214】",
    "【-204】",
    "【-193】",
    "看到這個傷害數字，曹星暗暗點了點頭。",
    "「很好，這傷害還在承受範圍之內。」",
    "「這些三階噬魂怪雖然也有高達五六百的攻擊力。」",
    "「但是被阿薩姆和布隆身上的護甲以及霜凍魔盾的抵消，已經被大幅度削弱。」",
    "「再加上卡門戰術的成功，能夠同時攻擊到他們的噬魂怪，只有四到六隻！」",
    "「這樣一來，他們就可以將那些怪物堵死在門外了！」",
    "看到這一幕，柳慕雪和姬心月同時舒了口氣。",
    "同時，姬心月看著曹星的背影，也不禁感到佩服。",
    "雖然這個男人擁有那麼多強大的招募生物，但也並沒有冒失自大，不顧一切的衝上去與這群噬魂怪正面交鋒。",
    "而是選擇穩紮穩打，利用一些簡單但好用的戰術。",
    "這樣的人，難怪能在這種末日世界發展得這麼快。",
    "姬心月如此想著。",
    "此刻，看到怪物們被擋住。",
    "不需要曹星多說，希兒妲和蕾妮絲都已經發出了最凌厲的攻擊。",
    "與此同時，曹星開始召喚兩個冰霜精靈，並且指揮道：「安德魯，隨時準備替補布隆的位置！」",
    "「慕雪，給布隆刷新聖盾。」",
    "「注意他們身上的流血狀態，隨時施展淨化術和聖愈術。」",
    "聖盾被摧毀後，需要60秒的凝聚時間。",
    "而這時候，柳慕雪再次釋放一個極光聖盾，就可以直接再次刷新出3層護盾。",
    "這也是曹星偶然發現的一種機制。",
    "柳慕雪點了點頭，然後抬起長劍，就為布隆附加了新的聖盾。",
    "然後，她注意到阿薩姆的血量下降到了80%，毫不猶豫的一道【聖愈術】施展過去。",
    "【+374】",
    "【+75】",
    "聖愈術有30秒的冷卻，而曹星的冰療術，30秒已經能夠恢復兩千多的血量。",
    "再加上阿薩姆身上還有【生命秘藥（小）】。",
    "相當於30秒能夠恢復至少三千的血量。",
    "與此同時。",
    "希兒妲肚子一甩，已經迅速孵化出了大量的血蛛。",
    "然後，她舔了舔嘴唇說道：「去吧，我的孩子們，讓它們嘗嘗血蛛一族的滋味~」",
    "那些血蛛全部沖了上去，然後開始了瘋狂自爆。",
    "不僅如此，希兒妲還開始噴射大片血毒，將通道門口全部覆蓋。",
    "那些噬魂怪身上的血毒層數開始迅速暴漲。",
    "沒一會就迭加到了10層的上限。",
    "而在血毒迭到10層後，它們每秒鐘都要承受希兒妲100%的攻擊傷害。",
    "霎時間，成片成片的傷害數字出現。",
    "【-331】",
    "【-334】",
    "【-346】",
    "【-314】",
    "……",
    "與此同時，布隆在承受了6次傷害後，體內的【寒冰血脈】噴發。",
    "配合【霜凍魔盾】，霎時間，一股恐怖的寒氣席捲！",
    "門口攻擊他們的四隻噬魂怪，全部被凍成了冰雕。",
    "趁著這個機會，所有人都開始不斷的輸出。",
    "唰！唰唰！",
    "一道道攻擊落下。",
    "與此同時。",
    "蕾妮絲目光一凝，對準其中一隻噬魂怪的眼睛，就是一道追風箭過去。",
    "【-747！】",
    "一個差點破千的傷害數字出現。",
    "系統更新後，命中要害會遭成額外傷害，再加上暴擊效果。",
    "這是她打出的最高一次傷害。",
    "而那隻噬魂怪的血量歸零，凍成冰雕的身體直接碎裂，然後化作一大堆冰塊散落一地。",
    "【你的領地成員：蕾妮絲·鷹眼擊殺了噬魂怪lv27，獲得經驗值：540】",
    "【戰鬥人員獲得經驗值：270】",
    "緊接著，另外三隻被冰凍的噬魂怪血量也同時歸零。",
    "三條系統提示出現。",
    "蕾妮絲身上出現了一道白光。",
    "【你的領地成員：蕾妮絲·經驗等級已提升，當前等級：16級。】",
    "曹星心裡一喜，「很好，蕾妮絲也升級了！」",
    "戰鬥逐漸步入了正規。",
    "一分鐘後，門口的噬魂怪再次倒下了7隻。",
    "而曹星也注意到，布隆的血量已經下降到了50%。",
    "他只是個普通級別的英雄，血量和護甲都比阿薩姆差了一大截。",
    "能夠越十幾級抗住那麼多的噬魂怪，已經很了不起了。",
    "於是，曹星直接下令道：「布隆，後撤，等待聖盾恢復。」",
    "「安德魯，頂上布隆的位置。」",
    "布隆聽從命令，直接後退。",
    "而安德魯則是直接化作一頭巨大的白熊，猛然沖了過去，頂上了布隆的位置。",
    "剛準備衝來的噬魂怪，再次被堵住了去路。",
    "早已等待多時的安德魯，如同一隻發狂的暴熊，人立站起，然後瘋狂揮舞巨大的熊掌拍擊。",
    "「噗！噗噗！」",
    "一隻只噬魂怪被發狂的安德魯拍飛。",
    "「吼！！！」",
    "安德魯發出震耳欲聾的咆哮聲！",
    "……",
    "嗚哇哇~！！！",
    "今天投月票的人好多，感言這裡都寫不過來了！！",
    "小作者在這裡統一感謝書友們的支持！",
    "(本章完)"
  ],
  "updatedAt": "2026-06-25T04:24:22.000Z"
}