{
  "novelId": "global-descent",
  "chapterNo": 245,
  "sourceLang": "cn",
  "targetLang": "cn",
  "title": {
    "source": "第245章",
    "translated": "ตอนที่ 245"
  },
  "status": "source",
  "paragraphs": [
    "全球降臨：帶著嫂嫂末世種田",
    "抵達頂層，搜刮古堡！（6000）",
    "抵達頂層，搜刮古堡！（6000）",
    "投票推薦 加入書籤 小說報錯",
    "抵達頂層，搜刮古堡！（6000）",
    "「先祖圖騰是我們薩爾的力量來源。」",
    "「所有黑煙薩滿在突破到首領後時，都會與先祖圖騰溝通，獲得不同的能力。」",
    "「而我這一次，溝通到的便是這位英靈。」",
    "聽完布洛特的解釋，曹星也是恍然點了點頭。",
    "很顯然，布洛特的這次蛻變，跟其他的黑煙薩滿都不同。",
    "他這次獲得的技能要強悍許多！",
    "畢竟，這召喚的可是統帥級生物。",
    "從領地中那個四階統帥——維多利亞的屬性就能看出來。",
    "這種級別的生物有多麼強悍！",
    "很顯然，這個技能超乎想像的不錯！",
    "接下來，就是要尋找通往頂層的通道。",
    "曹星下令道：「都四處去搜索一下，找一找進入頂層的方法。」",
    "得到的命令後，眾人迅速分散。",
    "包括曹星自己，也在古堡三層四處轉悠著。",
    "曹星搜尋了幾分鐘，也沒有找到什麼特殊的地方，或者通道之類的。",
    "包括其他人也沒什麼收穫。",
    "大不了他直接去窗戶邊上，使用【彈射鉤爪】，然後再順著鉤爪爬上去。",
    "這女巫，他今天必須要見！",
    "而就在這時，一抹倩影朝著他迅速走來。",
    "八條修長的長腿，在地板上優雅的挪動著。",
    "上半身，則是一具有著魔鬼身材的女性身體。",
    "「有什麼事嗎？希兒妲。」",
    "希兒妲微微昂起下巴，眼中帶著一抹高傲道：「想要寶箱嗎？」",
    "曹星聽罷似乎意識到了什麼，「當然想要！」",
    "希兒妲嘴角勾起一抹弧度。",
    "「嘁！跟我來吧，這一次，可是我一個人找到的。」",
    "說完，她便轉過身，向著古堡三層某個角落走去。",
    "很快，二人就在角落中發現了一堆雜物。",
    "而在那堆雜物下面，曹星看到了金黃色的箱體一角。",
    "「我去！又一個黃金寶箱！」",
    "畢竟，這是他進入這座古堡以來，發現的第二個黃金寶箱了！",
    "果然，開荒這種高等級地圖，收益就是高啊！",
    "這也讓曹星愈發期待，能在女巫古堡頂層，找到什麼收穫了。",
    "「希兒妲，做的不錯！」",
    "眼前的血蛛女王不屑道：「隨便找到的而已，看你那麼喜歡寶箱，本女王就大發慈悲幫你找一下。」",
    "曹星哈哈一笑，他也沒有在意。",
    "反正對於這個血蛛女王的性子，他早就熟悉了。",
    "湊上前去一看，系統提示出現。",
    "【發現塵封已久的黃金寶箱，是否開啟？】",
    "【獲得：中級機械工廠圖紙*1】",
    "【獲得：穢靈之戒（金）*1】",
    "【獲得：專家級元素結晶*2】",
    "「哈哈，居然是中級機械工廠圖紙！」",
    "看到系統提示，曹星頓時驚呼不已。",
    "同時，臉上瞬間出現狂喜之色。",
    "因為這張圖紙，就是曹星目前急需的東西之一。",
    "有了中級機械工廠後，他就可以製作運輸車，去更遠的地方開採資源。",
    "還可以製作電弧星，小型戰鬥無人機等等，進行現代戰爭等等。",
    "這時候，曹星手中又出現了一枚戒指。",
    "這枚戒指整體呈暗紫色，看起來像是金屬，又更像是水晶材質。",
    "【附帶特效①：精神+120，敏捷+80】",
    "【附帶特效②：附靈（增加15%的異常狀態附加率，包含流血，中毒，凍傷等等……）】",
    "【附帶特效③：穢靈（增加15%的異常傷害，包含腐蝕，生命流逝等等……）】",
    "（裝備介紹：一枚遺失的戒指，它曾經的主人是一名大巫妖。）",
    "看完屬性後，曹星若有所思。",
    "「增加異常狀態附加率和傷害的戒指嗎？」",
    "「這玩意，倒是可以給莎拉和蕾妮斯，她們正好都有流血傷害。」",
    "不過，曹星又看了眼希兒妲。",
    "她的【血毒】作為主要輸出手段，似乎也是一種異常狀態。",
    "就是不知道，能不能受到這枚戒指的加成？",
    "想了想，曹星還是決定試試。",
    "於是，他直接道：「希兒妲，把手伸出來。」",
    "在高達93點的忠誠度下，希兒妲不會拒絕曹星的命令。",
    "她帶著嫌棄的眼神，伸出了纖細的手臂。",
    "此刻，希兒妲手背上覆蓋著一層黑紗，增添了幾分清冷的美感。",
    "「嘁！你要本女王伸出手臂做什麼？」",
    "還不等她反應過來，曹星已經抓住了她的右手。",
    "在與曹星接觸的一瞬間，這個血蛛女王頓時渾身一顫，然後下意識的抽回了手臂。",
    "「你你你……你想做什麼？」",
    "「你居然敢觸碰本女王的身體！」",
    "曹星滿臉無語的看著她。",
    "而希兒妲似乎也反應了過來。",
    "她伸出右手，發現一枚暗紫色的戒指，就出現在了她的中指上。",
    "那帶著煙燻妝的美目中，出現了驚訝的神色。",
    "曹星問道：「怎麼樣，這枚戒指對你有用嗎？」",
    "他比較在意，這枚戒指能不能加強希兒妲的血毒效果。",
    "希兒妲聽罷，也細細感受了一番。",
    "「我在上面，感受到了一股陰冷的能量，這枚戒指，似乎能增強我的血毒腐蝕強度。」",
    "聽到這話，曹星臉上也出現了笑意。",
    "希兒妲伸出好看的右手，仔細的觀察著這枚戒指。",
    "然後問道：「你這是，給本女王的禮物嗎？」",
    "曹星一愣，然後笑道：「算是吧。」",
    "希兒妲聽罷，那妖異的絕美面容上，勾起了一個弧度。",
    "說到這裡，她像是反應了過來，然後嫌棄道：",
    "「嘁！本女王才不稀罕你的禮物……」",
    "【因你的慷慨贈與，希兒妲·血吻忠誠度已提升，當前忠誠度：97】",
    "這下，算是把這個血蛛女王掉的忠誠度補回來了。",
    "然後，他們便繼續在塔樓中尋找著。",
    "這時候，蕾妮斯手持角鷹大弓走了過來，恭敬的匯報。",
    "「領主大人，我在前方發現了一個不對勁的地方。」",
    "「那裡好像是一個水池，但是上面有一層隱藏能量罩，憑我的力量，似乎打不破它。」",
    "蕾妮斯有【狩獵之眼】這個技能，可以看穿一些隱藏的東西。",
    "曹星聽到這話，頓時意識到了什麼。",
    "「居然有這種地方？蕾妮斯，帶我過去看看。」",
    "很快，他們就來到了蕾妮斯所說的，那一潭黑色水池旁。",
    "水池不大，四四方方，大概有個七八平米。",
    "而曹星的【真視之眼】也能看出來，上面有著一層隱藏的能量護盾。",
    "【耐久度：200000/200000】",
    "【附帶效果：超限符文（免疫五階以下的攻擊）】",
    "「免疫五階以下的攻擊嗎？」",
    "曹星眼中帶著思索之色。",
    "很顯然，現在就是使用【薇薇安的髮簪（橙）】的時候。",
    "於是，曹星從背包中取出那根玉簪。",
    "那個黑色水池上面的結界瞬間消散。",
    "一股無形的能量開始散發。",
    "水池中升騰起了大量的黑色迷霧。",
    "「嘩啦……嘩啦啦……」",
    "黑色的液體在下方翻湧。",
    "沒一會，居然在上方出現了一個傳送門的形狀。",
    "曹星也是提起精神，注視著眼前的動靜。",
    "當傳送門徹底成型後，曹星也看到了上面的屬性。",
    "【作用：踏入傳送門，可前往古堡最頂層】",
    "「好傢夥，原來是這樣！」",
    "「太好了，通往頂層的傳送門，打開了！」",
    "他欣喜不已，然後直接把所有人都喊了過來。",
    "眾人圍著這個傳送門，眼中也帶著好奇的神色。",
    "曹星決定，還是由阿薩姆先進入。",
    "阿薩姆身體一正，然後毫不猶豫的，一步踏入了傳送陣當中。",
    "下一刻，霜狼騎士高大的身影消失。",
    "片刻後，曹星通過耳朵上的通訊裝置問道：「阿薩姆，情況如何。」",
    "「回領主大人，我目前的狀況還好。」",
    "「這裡看起來也是一個古堡大廳，旁邊有很多房間，我聞到了好濃郁的草藥香味。」",
    "聽到這話，曹星眼中也是出現了好奇的神色。",
    "然後他直接說道：「走，我們也進去。」",
    "話落，他便帶著眾人，一起踏入了傳送門當中。",
    "當曹星視線恢復的時候，他首先看到了自己身邊的手下們。",
    "柳慕雪舉著盾牌，警惕的護衛在他身側。",
    "而曹星也開始觀察四周的情況。",
    "古堡頂層的光線依舊顯得十分昏暗。",
    "只有月光透過頭頂的窗戶灑下。",
    "只能隱約看到前方的場景。",
    "確實如阿薩姆所說，在前方出現了一個寬廣的大廳。",
    "大廳中間有著一個奇怪的巨大法陣，邊緣處出現了一層黑色的粉末，看起來好像有什麼邪惡的生物，從法陣中出現了一般。",
    "而在大廳兩側，則是一個個用木門關起來的小房子。",
    "小埃麗莎不斷聳動著鼻子，似乎在聞著什麼。",
    "「好香！是餅乾的味道！」",
    "而旁邊的半人馬卻說道：「不，這好像是各種植物混合的味道！」",
    "包括曹星，也聞到了一種特殊的香味。",
    "眾人紛紛聞著這股奇怪的藥香。",
    "曹星直接道：「味道好像是從那些房間裡面散發出來的，我們過去看看。」",
    "說完，他便順著藥草的香味，徑直推開了其中一間房間。",
    "頓時被眼前的景象驚住。",
    "裡面是一排排貨架，而在貨架旁邊，則是擺放著各種各樣的藥水！",
    "這些藥水有的是紅色，有的是綠色，一眼看去，琳琅滿目。",
    "而且，通過這些藥水中蘊含的氣息就能感應出來，品質一定很高！",
    "「好傢夥，這麼多藥水？」",
    "然後，他像是發現了某種寶藏一般，迅速的沖了過去。",
    "連屬性都沒看，直接就將這些藥水全部收了起來。",
    "【獲得：生命秘藥（中）*147】",
    "【獲得：魔力秘藥（中）*32】",
    "【獲得：生命秘藥（大）*15】",
    "【獲得：中型力量秘藥*5】",
    "【獲得：中型精神秘藥*6】",
    "【獲得：中型疾風秘藥*6】",
    "這一刻，曹星直接驚呼出聲。",
    "他完全沒有想到，這裡面居然會有這麼多的秘藥，而且品質都還不低！",
    "要知道，最便宜的【生命秘藥（中）】，按照市場價也賣到4000克朗一瓶了！",
    "光這一百多瓶生命秘藥的價值，就價值60萬克朗了！",
    "而且很顯然，下面的那些秘藥，價值更高。",
    "帶著激動的心情，曹星迫不及待的看了眼屬性。",
    "【生命秘藥（中）：服用後，可馬上恢復1000點生命值，冷卻時間30秒】",
    "【魔力秘藥（中）：服用後，可馬上恢復中量精神力，冷卻時間45秒】",
    "【生命秘藥（大）：服用後，可馬上恢復5000點生命值，冷卻時間：45秒】",
    "【中型力量秘藥：服用後，接下來30分鐘內，力量+50】",
    "【中型精神秘藥：服用後，接下來30分鐘內，精神+50】",
    "【中型疾風藥劑：服用後，接下來30分鐘內，敏捷+50，移動速度+10%】",
    "（註：中型屬性秘藥蘊含的力量太過強烈，需二階以上的生物才可服用。）",
    "「哈哈，發財了發財了！」",
    "這些秘藥的效果一個比一個恐怖。",
    "尤其是那個【生命秘藥（大）】，居然能直接回復5000點生命值。",
    "而曹星的【改良版生命秘藥配方（中）】，也只能回復2000點生命值。",
    "不過，改良版的冷卻時間只有30秒。",
    "除此之外，那些加屬性的秘藥也非常強大。",
    "居然能直接增加50的力量和精神，至少相當於一百多點攻擊力的提升了！",
    "像這種帶持續時間的秘藥，大概率能受到【永恆之力】的加持。",
    "也就是說，曹星只需要喝下去一瓶，就可以永久享受到這種加成效果。",
    "「SSS級天賦真爽啊，又給我省下了不少資源！」",
    "他當場就決定，先將這些秘藥完全發了下去。",
    "畢竟，這種珍貴的秘藥，當然是要用來提升自己！",
    "6瓶【中級精神秘藥】，他分給了柳慕雪，希兒妲，伊莎貝爾，安德魯，布洛特，還有自己一人一瓶。",
    "6瓶【中級疾風秘藥】，曹星分給了莎拉，蕾妮斯，埃麗莎，以及三名噩夢弓箭手一人一瓶。",
    "【中級力量秘藥】的數量少一點，只有5瓶。",
    "曹星給了阿薩姆，兩個龍血鬥士，拉布，以及布隆五人。",
    "此刻，分到了秘藥的人，都握著手中的藥瓶，眼中帶著激動的神色。",
    "他們自然能感應到，這些秘藥中蘊含的氣息，可以讓他們變得更強？",
    "曹星說道：「好了，都開始服用吧。」",
    "「沒分到的也不要著急，後面我們去下一個房間再找一找。」",
    "眾人聽罷，也紛紛點了點頭。",
    "曹星率先將手中的這瓶藍色秘藥，一飲而盡！",
    "瞬間，一股奇特的力量流入了他的胃中。",
    "沒過多久，他感覺到有一股清涼的力量，沖入了頭頂！",
    "這一刻，系統提示接連出現。",
    "[成功服用【中型精神秘藥】，精神+50，受天賦【永恆之力】影響，該狀態已變為永久存在……]",
    "[你的領地成員：莎拉·刃舞成功服用【中型疾風秘藥】，敏捷+50，移動速度+10%，受天賦【永恆之力】影響，該狀態已變為永久存在……]",
    "服用完秘藥的人，均感覺到自己的力量得到了大幅度提升，眼中帶著興奮的神色。",
    "而嘗到了甜頭的曹星，也十分激動。",
    "要知道，這座大廳旁邊，還有幾個小房間沒有探索呢。",
    "如果每間房子裡面，都有這麼多收穫，那這次曹星賺大了！",
    "帶著激動的心情，曹星下令道。",
    "「走，我們去下一個房間。」",
    "很快，他們就推開了第二個房間的大門！",
    "與第一個房間一樣，裡面有很多貨架，上面琳琅滿目的擺放著五顏六色的秘藥！",
    "曹星按捺住激動的心情，迅速走過去，將上面的秘藥全部收了起來。",
    "【獲得：生命秘藥（中）*113】",
    "【獲得：魔力秘藥（中）*27】",
    "【獲得：生命秘藥（大）*33】",
    "【獲得：中型力量秘藥*8】",
    "【獲得：中型精神秘藥*7】",
    "【獲得：中型疾風秘藥*9】",
    "【獲得：中型體魄秘藥*5】",
    "「哈哈！這間房間裡的秘藥更多！」",
    "照例分了兩瓶【中型力量秘藥】給坎特爾和坎達爾。",
    "又把那5瓶【中型體魄秘藥】分給了布隆和阿薩姆，還有他自己和柳慕雪，以及安德魯各一瓶。",
    "[成功服用【中型體魄秘藥】，體質+50，受天賦【永恆之力】影響，該狀態已變為永久存在……]",
    "「不錯不錯，又提升了不少血量。」",
    "然後，他們就來到了第三個房間。",
    "也是大廳左邊，最後一間房間。",
    "裡面頓時有一股濃郁的草藥香味傳來。",
    "這裡面，似乎不是存放那些秘藥的地方，而更像是煉藥的地方。",
    "在房間中心，擺放著一口黑色的坩堝。",
    "上面盛放著一些綠色的藥劑，還在『咕嘟咕嘟』的冒著氣泡。",
    "【女巫坩堝（橙）：特殊道具】",
    "【效果：可加快30%煉藥速度，增加20%煉藥成功率】",
    "（介紹：女巫的坩堝，可大幅度加快煉藥速度和成功率，是所有煉藥師都想要擁有的神奇物品。）",
    "「好傢夥！居然又是一件橙色道具，而且還能增加成功率！」",
    "正如備註上所說的，對於煉藥師來說，這是神器級別的存在！",
    "曹星幾乎是下意識的，將這玩意收進了背包中。",
    "【獲得：女巫坩堝（橙）】",
    "「很好，這下子已經完全不虛此行了！」",
    "除了這個坩堝外，曹星還在旁邊看到了幾瓶不一樣的藥劑。",
    "一瓶是青色，一瓶金色，還有一瓶白色的秘藥。",
    "液體中混合著一些晶瑩的粉末流淌。",
    "似乎剛煉製出來沒多久。",
    "他將這三瓶秘藥收了起來。",
    "【獲得：女巫的燕子秘藥*1】",
    "【獲得：女巫的金鶯秘藥*1】",
    "【獲得：女巫的白嘴鴉秘藥*1】",
    "「哦？新的秘藥？有啥作用嗎？」",
    "【女巫的燕子秘藥：服用後，可增加25%的閃避率，效果持續1分鐘】",
    "【女巫的金鶯秘藥：塗抹在武器上，使接下來的10次攻擊，附帶金鶯之蝕效果，最多削減敵人10%的護甲（可與其他狀態迭加）】",
    "【女巫的白嘴鴉秘藥：服用後，使近戰職業的攻擊速度加快20%，並且增加20%的肢解概率，但如果體質不足，將會傷害到肌肉，對自身造成撕裂效果。】",
    "「三種有著特殊能力的秘藥嗎？」",
    "「效果倒是挺恐怖的，可惜只有1瓶。」",
    "曹星先將其收進了背包中，沒有第一時間使用。",
    "然後迫不及待的說道：「走，我們繼續搜。」",
    "在大廳的另一側，他們還看到了幾間房間。",
    "曹星也很期待，能在裡面找到什麼。",
    "很快，他們就來到了對面。",
    "而裡面的東西，曹星再次瞳孔一縮！",
    "因為他看到了許多種植起來的植物。",
    "上面還有一些曹星所熟悉的魔法植物！",
    "很顯然，這些是女巫用來煉藥的藥草。",
    "「好傢夥！居然連金色的魔法植物都有！」",
    "【神秘四葉草（金）：魔法植物】",
    "【效果：蘊含著神秘力量的四葉草，食用後，可隨機提升一項屬性（包括四維屬性，魅力，幸運值，攻擊力，生命值等等），是用來製作某些高級秘藥的材料。】",
    "「哦？居然還可以增加幸運值和魅力值。」",
    "「不愧是金色品質的魔法植物！」",
    "曹星毫不猶豫的，將這些材料全部搜刮一空。",
    "【獲得：靈息草（綠）*102】",
    "【獲得：月凝花（藍）*32】",
    "【獲得：紅番蓮（藍）*39】",
    "【獲得：神秘四葉草（金）*4】",
    "（PS：明天繼續一萬六！古堡劇情就結束啦，鋪墊了這麼久，終於要見到這位傳說中的女巫了，這是位很重要的角色哦~）",
    "上一章 章節目錄 下一章",
    "溫馨提示：按 回車[Enter]鍵 返回書目，按 ←鍵 返回上一頁， 按 →鍵 進入下一頁，加入書籤方便您下次繼續閱讀。"
  ],
  "updatedAt": "2026-06-25T04:25:16.000Z"
}