{
  "novelId": "global-descent",
  "chapterNo": 1205,
  "sourceLang": "cn",
  "targetLang": "cn",
  "title": {
    "source": "第1205章 卓拉真神?重返巔峰的方法",
    "translated": "ตอนที่ 1205"
  },
  "status": "source",
  "paragraphs": [
    "全球降臨：帶著嫂嫂末世種田第1205章",
    "卓拉真神?重返巔峰的方法,一條小白蛇",
    "全球降臨：帶著嫂嫂末世種田",
    "卓拉真神?重返巔峰的方法",
    "卓拉真神?重返巔峰的方法",
    "全球降臨：帶著嫂嫂末世種田",
    "全球降臨：帶著嫂嫂末世種田",
    "卓拉真神?重返巔峰的方法",
    "諸如種種寶物，都是當前迫切需要搜集的，每一件都能提升領地的戰力。",
    "不過，要想尋找到這些裝備，都需要用到圣樹的特殊能力本源追溯。",
    "經過這段時間的恢復，圣樹雖然已經可以再次使用這種神奇的能力，但卻也只能使用一次。",
    "在此之前，還是先詢問下關于卓拉的情況更為重要。",
    "“大人，那現在我們應該怎么辦？”副官又來詢問，安洛克也被這幾天毫無進展的結果搞得心煩意亂，聽到副官來到自己面前征求意見，這個戰斧軍團的的團長張口就想罵人。",
    "一位黑袍老者，不過從渾身散發出的波動都足以嚇人，比起鬼靈宗宗主都要強上不少。",
    "張大鏢頭見狀心中忍不住也犯起了嘀咕，這是什么情況，里面三人難不成是同歸于盡了嗎？",
    "迅速回頭望去，她愕然發現轎車的飛行軌跡上竟然有他人的身影。",
    "摸了摸臉頰和糟亂的頭發，骨內火焰迅速開始蒸騰，相較之前在脈路中的流動，要更強出不少。",
    "這個亡靈生物與之前所遇到的完全不同，在力量的等級上怕是要比現階段的火神還要高。",
    "夏侯惇等人急忙轉身觀看，果然就見城外漫山遍野的虎威軍大舉攻城，數十輛樓車已經推到城壕之前。原來今天郭嘉擔心大哥有失，故意隨軍出戰，眼看高云殺入城中，又見城門關閉，大驚駭然，急忙傳令，樓車攻城。",
    "當然，幽蜮生物不弱，依靠龐大基數，一有可乘之機，在機甲上留下傷口，滲透入幽蜮之力，腐蝕掉光明力量，若不是有光明佛性領域壓制，幽蜮之力瞬間爆發，能將天使轉化成幽蜮生物。",
    "高云騎著早已被鮮血染紅的“雪麒麟”，在涿縣城內四處搜尋，從日中殺到日落，除了滿地的死尸，他終于再也找不到一個黃巾兵的影子。",
    "無聲無息間，一排身穿黑甲的騎兵出現在了洛天的不遠處，冷冷的看著他。神甲軍，原本百人的神甲軍現在只剩下了九十八人，其中有兩人被洛天直接干掉了。",
    "趴在地上回頭一看，惡虎的尸體距離自己不過數尺！剛才只顧問姑娘話兒了，誰知道畜生也知道玩陰的，悄悄就摸到了他的身后！不是人家這一腳加兩箭，自己怕是早已經被惡虎咬死叼走了。",
    "交待完畢后，陳金亭躬身俯首的又慢慢的挪回了宮萍和姚莉娜藏身的地方。",
    "不光是士兵，此時就連軍神跟戰雄豪也完全的處于了呆滯的狀態。",
    "丁侯爺聽得出來紫萱的威脅，他想了想道：“好吧，我對芳菲說就是，她向來是懂事的，不會讓我為難。”他說完還特意看一眼紫萱，無異是在說紫萱是向來為難他的人。",
    "泥巴沖上楊妄的脖子，哀嚎起來，而柳卿正在一邊緊張的看著他，看到他沒事之后，她才松了一口氣。",
    "所以他決定，剛進入地底的時候，他差不多就要破開血管觸手出來了。那樣的話，不斷可以逃生，也可以稍微的遮擋一下金鑾的視線，畢竟現在金鑾連他在哪里都不知道。",
    "樓房中突然想起的爆炸聲和激烈的槍聲本就分散了這幾個黑衣人的注意力，看到突然破窗而出的我后，更是讓這幾個黑衣人目瞪口呆的沒有反應過來。",
    "是的，楊妄唯一忘記了，姜北鎮到達了人丹之后，就覺醒了傳承神通。",
    "游戲熟練程度如果相差不多，比的就是心理素質還有反應速度，其實這些林成都比其他人要好，雖然林成對游戲的熟練程度不如這些游戲高手，但是林成的手指靈活度絕對超過這些人，所以兩項相抵，也差不多。",
    "“我弄到了一萬億的資金！”白衣人從自己的口袋中掏出一張瑞士銀行的白金VIP銀行卡，恭敬地遞給了姜華。",
    "墨擎宇說的話信息量實在太大了，哪怕是經歷了暴風雨的墨晏城此時也不知道這到底怎么一回事。",
    "趁他被糾纏，葉孤鴻厲嘯一聲，飛身而至，凌空一掌“飛龍在天”重重拍落。",
    "畢竟是做好了隨時下畫，進入DVD市場的準備的，花個上千萬美元，還怎么往回賺？",
    "劉老太婆那一只獨眼死死盯著羅老三，兩人對峙了很久之后，最終是她撐不下來。",
    "張奕無論用雷殛和白梟射擊，或者用虛空斬，都能發揮出自身能力的優勢。",
    "但是禍兮福之所倚，福兮禍之所伏，這圣陰陽也算是牛角二十七卦中最奇的卦象，有兇有吉，陰陽分明各有利。",
    "有了這些人，兵源可以得到補充不說，第四生命倉的勞動力就更不愁了。",
    "至于說壓根不去參加明年的奧運會總導演競選，只在顧銘的腦海里閃了不到半秒鐘就被否了。",
    "這么多人提著禮品一起走，而且顧銘的保鏢一個個的都人高馬大的，一看就不一般。",
    "顧傾心根據佐治發的地址來到夜色會所，一進門就有侍應生接待她，將她領到佐治所在的包廂。",
    "“會、會長！這樣不符合規定吧？”團子臉考官有些焦急的說道。",
    "鄭東體悟了初級火之心凝聚了神火珠，等于是掌握了一絲火之道韻，任何火焰類術法對他施展都會大打折扣，弱些的更是直接會被他反過來利用，燕青宇偏偏是火屬性修士，可說先天上已經被鄭東克制死死的。",
    "“沒什么，就是想讓你嘗嘗欲仙欲死的滋味罷了。”林曦將一口茶吐在了地上，若無其事的說道。",
    "可越是靠近他，她就越想靠近，心里的天平在搖擺不定的時候，就已經一頭倒的壓在了他的身上。現在的她比之前更加貪念他的味道，與之同時，更加害怕的是他的離開。",
    "全球降臨：帶著嫂嫂末世種田目錄",
    "全球降臨：帶著嫂嫂末世種田",
    "hjwzw@live.com"
  ],
  "updatedAt": "2026-06-25T04:03:59.000Z"
}