{
  "novelId": "global-descent",
  "chapterNo": 918,
  "sourceLang": "cn",
  "targetLang": "cn",
  "title": {
    "source": "第918章 狂熱的巨人們,集體賜福",
    "translated": "ตอนที่ 918"
  },
  "status": "source",
  "paragraphs": [
    "全球降臨：帶著嫂嫂末世種田 第918章 狂熱的巨人們,集體賜福",
    "孟毅喃喃的說道：“居然一下子增加了幾萬的氣運值……”",
    "“這漲幅……都相當于幾十尊甚至上百尊傳奇了……”",
    "“曹星，你做了什么？”",
    "孟毅眉頭微皺，眼中閃過一絲思索。",
    "幸存者中，沒有人比他更清楚，氣運值的暴漲意味著什么。",
    "這意味著他要么又完成了什么足以改變世界格局的大事件，要么是領地實力暴增。",
    "不過片刻后，他臉上便重新出現了笑容。",
    "“不錯……不愧是這一代的天選領主，總能給人帶來驚喜……”",
    "“本來以為，你一個人孤軍奮戰，有些獨木難支，所以我第一時間找你結盟。”",
    "“現在看來……即使沒有我的幫助，你也能在未來的大變局中，占據一席之地。”",
    "孟毅低聲自語，臉上沒有出現絲毫的嫉妒或不安。",
    "作為體驗了百萬次死亡輪回的存在，他已經看透了太多事情。",
    "“既然你那邊已經開始了行動，作為盟友，我這邊也不能落后啊……”",
    "話落，他緩緩站起身來，聲音逐漸冷冽：“傳令下去。”",
    "“即刻起，集結帝國所有復蘇的傳奇、半神，前往西大陸各大王國邊境！”",
    "“除了北境之外，其他王國必須在三日內做出選擇。”",
    "“告訴他們，要么將兵權交出來，臣服于帝國！”",
    "“要么，就等著被帝國的鐵騎踏平！”",
    "他的聲音回蕩在宏偉的殿堂中，帶著不容置疑的威嚴！",
    "下方，許多道強悍的身影恭敬的站在原地，每一位都散發著令人窒息的威壓。",
    "當聽到孟毅下達的命令時，他們神色一變，許多人眼中閃過震驚與猶豫。",
    "但是，卻沒有任何人敢提出異議。",
    "所有強者單膝跪地，齊聲應道：“遵命，救世者！”",
    "曹星已經順利將所有傳奇以及傳奇以上的冰原巨人招募進了領地中。",
    "這一次，累計招募到了傳奇級冰原巨人59尊，半神級冰原巨人4尊。",
    "累計獲得49500點氣運值！",
    "這可是一個相當大的提升了。",
    "相當于能增加全球20億人族4.95的殺怪經驗值、資源產出、人口上限、移動速度！",
    "而且，這還僅僅只是一座主戰場中的巨人數量。",
    "按照弗倫族長所說，另外三處主戰場加起來，一共還有46尊傳奇巨人。",
    "也就是說，冰原巨人目前的現存戰力是：傳奇巨人95尊，半神級巨人4尊。",
    "聽起來很多，但要知道，這是這個種族發展了上萬年的底蘊。",
    "而且，這些年戰死的傳奇巨人數量，遠遠不止這個數字！",
    "冰原巨人一族，號稱為了戰斗而生種族，個個都有著強大的戰力！",
    "在巔峰時期，甚至超越過巨人主脈，連神靈級巨人都誕生過不止一尊。",
    "現在這點戰斗力，甚至連他們巔峰時期的十分之一都不到……",
    "之所以衰敗到現在這個地步，最大的原因自然是因為當年的當場巨龍戰爭。",
    "在與諾恩一族共同對抗卓瑪的過程中，他們付出了太多犧牲，連神靈級巨人都盡數隕落。",
    "而且，即使巨龍戰爭結束后，他們依然屹立在永凍之海深處，抵御卓瑪的冰巢怪大軍。",
    "數千年的堅守，同樣葬送了大量冰原巨人的生命。",
    "曹星搖了搖頭，也不再多想。",
    "畢竟這些歷史遺留問題不是他造成的。",
    "他現在要做的，就是聯合一切力量，應對接下來卓瑪復蘇帶來的危機。",
    "與此同時，那些傳奇、半神級冰原巨人，在加入曹星領地后，也第一時間受到了蒼白之樹的生命賜福。",
    "浩瀚的生命力將他們全身籠罩，并且迅速修復著他們身上積累千年的傷痕。",
    "就連那三尊半神級的巨人，身體的傷勢也在以肉眼可見的速度愈合。",
    "其中那名半邊身子被巨龍力量腐蝕的巨人，基礎生命值從35億瞬間暴增到70億！",
    "堪稱無窮的生命力涌現，使他皮膚表面的冰霜迅速褪去，只殘留淡淡的一層冷凝腐敗。",
    "只需要光羽雞再來一波神圣之光便能徹底清除。",
    "而那名只剩下獨臂的巨人，傷口處凝結著的詭異冰晶也在以肉眼可見的速度消融。",
    "另一名拄著冰晶拐杖的巨人，頭頂不斷冒出陣陣煙霧，那是積壓了多年的腐蝕之力正在被凈化。",
    "他們閉上了眼睛，似乎在享受這久違的舒適感。",
    "直到片刻后，所有巨人逐漸睜開了眼睛。",
    "他們瞪著銅鈴般的大眼，一臉狂熱的看向曹星！",
    "那眼神，簡直如同在看救世主！",
    "“偉大的曹星領主，您的力量如此神圣，讓我們重獲新生！”",
    "三尊半神級冰原巨人激動得聲音發顫：“感謝您的恩賜，這簡直是神跡！”",
    "這一次，他們不再單膝跪地，而是雙膝跪地，匍匐在冰面上。",
    "用最虔誠的禮儀，表達著自己最崇高的敬意。",
    "包括其他的傳奇冰原巨人，甚至弗倫族長也毫不猶豫跪伏在地！",
    "沒有人比他更清楚，這一次被封印的冰原巨人們集體恢復戰力意味著什么。",
    "意味著冰原巨人一族，以后遇到戰斗再也不需要等到生死存亡的關頭，再將那些封印的巨人喚醒，進行最后一戰。",
    "意味著他們今后會減少許多許多的犧牲。",
    "意味著族群的實力將在今天大幅度提升，即使是卓瑪的冰巢怪大軍，也沒有那么容易將他們擊潰。",
    "而這一切，都源于這位異世界領主！",
    "這一刻，弗倫族長看向曹星的目光，如同在看一尊神靈！",
    "因你的言行，已打動冰原巨人族族長：弗倫·寒錘，忠誠度已大幅度提升",
    "因你救助了大量冰原巨人族戰士，該種族好感度大幅度提升！",
    "（注：狂熱好感度下，所有冰原巨人會將你視為族群的英雄，你有更大概率競選該族族長、領袖、長老等位置。）",
    "連續兩條提示，讓曹星微微一愣。",
    "尤其是第二條，更是讓他感到有些意外。",
    "說起來，這還是他第一次將一個族群或者一個勢力的好感度提升到狂熱程度。",
    "原來，到了這個級別，就可以競選巨人族的族長了。",
    "曹星笑了笑，他對這個族長位置并沒有什么興趣。",
    "“好了，諸位都起來吧。”",
    "他那平靜的聲音在人群中響起：“這只是加入我的領地后，最基礎的一種能力，真正的賜福還遠沒有結束。”",
    "一眾巨人們聽罷，眼中紛紛浮現出茫然之色。",
    "畢竟，光是這種讓他們的生命力暴漲近一倍的賜福，就已經駭人聽聞！",
    "結果，這名年輕的人類領主卻說這僅僅是開始？",
    "他們面面相覷，粗獷的面容上寫滿了震驚與難以置信。",
    "曹星沒有多做解釋，直接取出了奈莎女神的賜福之環。",
    "神圣的光環被他托在手中，散發著純凈而神圣的光芒。",
    "隨著光芒一閃，一個直徑達到100米的光圈浮現，并且緩緩落在了冰面上。",
    "曹星朗聲道：“剛剛加入了我領地的巨人們，現在全部進入光圈中。”",
    "他補充道：“你們的體型太大了，這100米的光圈可能容納不了這么多人。”",
    "“有飛行能力的巨人飛到半空中，盡量給其他人挪出更多的位置。”",
    "聽到這話，所有冰原巨人臉上浮現茫然之色，似乎不太理解這位人類領主的意圖。",
    "但他們沒有多做猶豫，立即行動了起來。",
    "率先進入的是那三尊半神級巨人，他們小心翼翼的挪動龐大的身軀，來到了光圈中央。",
    "然后，其他傳奇巨人也試著踏入。",
    "隨著一個個巨人進入，很快，那片直徑100米的光圈就快被塞滿了。",
    "正如曹星預料的那樣，這些大塊頭動不動就是上百米的身高，即使站著也占據不小的面積。",
    "才進了二十個巨人不到，就已經顯得十分擁擠了。",
    "他無奈的搖搖頭，說道：“別傻站著，再擠一擠，把身體縮小一點。”",
    "“還有你們，盡量往天上飛，把天上的空間利用起來。”",
    "雖然說，這個奈莎女神的賜福光環有著高度的限制，但巨人們只要將身體蜷縮，或者利用好空間，還是能夠塞下的。",
    "幾十尊冰原巨人聽到曹星指令，下意識的照做。",
    "然后，便出現了滑稽的一幕。",
    "這些在戰場上殺敵無數，氣勢兇殘的巨人們像沙丁魚罐頭一樣擠作一團。",
    "有的被迫單腳站立，有的不得不抱著同伴的肩膀。",
    "幾尊會飛的巨人懸浮在半空，像氣球一樣飄來飄去。",
    "甚至有兩尊巨人因為體型實在太大，只能把半個身子探進光圈，下半身還留在外面。",
    "這也讓曹星意識到了另外一個問題。",
    "“隨著我的實力不斷提升，遇到的強者也越來越多。”",
    "“這些強者中，有很多都是體型夸張的存在。”",
    "“換句話說，奈莎的賜福光環范圍已經快不夠用了。”",
    "他若有所思的說道：“看來，回去后得用一顆七彩水晶，將這件傳說級道具強化一下。”",
    "其他的冰原巨人們看著昔日讓他們仰望的傳奇戰士，甚至長老們像迭羅漢一樣擠在一起，都有些忍俊不禁。",
    "但他們也都盡力憋住，不讓自己笑出聲。",
    "不過……雖然樣子看上去比較滑稽，好在最后還是勉強完成了。",
    "一共63尊巨人全部進入了賜福范圍。",
    "他們屏息凝神，默默等待著那位人類領主所說的賜福。",
    "曹星也沒有讓他們等太久，先是指揮光羽雞浮力，催動了凈化之光。",
    "蘊含著神圣凈化之力的光團落入賜福范圍之內，被瞬間擴散開來，落在所有巨人身上。",
    "這些巨人都感覺到了，自己體內多出了一股溫暖的力量，將他們體表殘留的冷凝腐敗迅速清除。",
    "還不等巨人們瞳孔中浮現震撼之色。",
    "曹星一聲令下：“開始吧。”",
    "站在他身后的一眾強者們聽罷，迅速將各自的狀態技能丟了過去！",
    "風系法師艾倫一襲青色法袍無風自動，浩瀚的風元素之力被他調動。",
    "緊接著，兩道綠色的魔法落入了光圈之中。",
    "巨龍薩滿維姆涅法杖一抬，一頭雷龍的虛影在背后凝聚。",
    "下一刻，隨著他法杖一點。",
    "沉悶的炸響聲之后，那頭雷龍直接落入了光圈之中。",
    "與此同時，冠軍斗士奇農深吸一口氣，將手中的傳說長槍猛地擲入高空。",
    "光圈范圍內的巨人們，頓時感覺到自己的身體變得更加輕盈，同時還有一股洶涌的力量涌入體內，讓他們攻擊力大幅度提升！",
    "然而，這還僅僅只是開始！",
    "隨著女祭司法娜茲凝聚大量的瘟疫之力，輕輕一點。",
    "巨人們頓時感覺到身體一熱，暴擊率大幅度提升。",
    "正是她的狀態技能：災厄之祭！",
    "緊接著，血蛛女王希兒妲的女王意志降臨，讓巨人的速度再次暴增一大截！",
    "除此之外，還有安德魯的荊棘術、生命綻放。",
    "沃利貝爾的雷霆之盾，伊勒娜的蛇人族狂化、致命毒素。",
    "以及曹星的冰甲術、冰療術、霜凍魔盾等等……",
    "一系列狀態技能，全部一股腦的加持在巨人們身上。",
    "這些來自不同種族、不同職業的強大增益效果在奈莎女神的賜福光環，與曹星的永恒之力加持下，讓他們的實力迎來了前所未有的提升。",
    "所有冰原巨人的生命值開始不斷回復，移動速度、攻擊力、護甲、反傷、精神、護盾等等……",
    "而其他巨人們站在原地，眼中已經充滿了震撼。",
    "他們能夠清晰的感覺到，這些本身就無比強悍的巨人戰士們，身上的氣息隨著那些強者的賜福，正在發生質的變化。",
    "一個個如同脫胎換骨一般，給人帶來強烈的壓迫感！",
    "那些巨人們眼中流露出深深的震撼與羨慕！",
    "而就在這時，曹星注意到背后出現了兩道火熱的視線。",
    "回過頭望去，發現是卡莎女王和神木老者。",
    "他們知道，現在這群巨人們獲得的力量，就是曹星所說的賜福。",
    "不光能讓他們擁有遠超同階的戰斗力，還能擁有無與倫比的生存力和各種神奇的能力。",
    "這也是他們一直渴望卻不敢奢求的力量。",
    "而現在，曹星卻為這些第一次見面的冰原巨人慷慨賜福，也沒有為他們賦予。",
    "一時間，心中有些酸澀與失落。",
    "不過聯想到自己階下囚的身份，他們只能默默低下頭。",
    "畢竟，這位領主能讓他們活下來已經是莫大的仁慈，不能奢求太多。",
    "而就在這時，曹星的聲音突然響起。",
    "“你們兩個，自己也擠進去吧。”",
    "聽到這句話，二人同時抬起頭，看向自己的領主。",
    "眼中浮現茫然之色，似乎有些不確定這句話是不是對他們說的。",
    "曹星繼續道：“愣著干嘛？快點進去。”",
    "直到這時，他們才確信，這句話真的是對自己說的！",
    "卡莎女王一只手拽著衣袍一角，聲音微顫：“我……我們真的可以嗎？”",
    "神木老者也緊張的握緊了手中的枯木法杖。",
    "曹星不耐煩的揮手：“別廢話，一會我們的狀態技能都釋放完了，你們就吃不到幾個賜福了。”",
    "二人聽到這話，幾乎沒有任何猶豫，迅速行動了起來！",
    "顧不上形象，直接擠進了那一堆巨人中間，找了個角落站定。",
    "這時候，眾人的狀態技能紛紛落在光圈上。",
    "卡莎女王和神木老者頓時感覺到，自己的身體中，永久多出了數種強大的增加效果！",
    "他們身上的氣息不斷增長，實力也在不斷提升。",
    "此刻，二人感受著體內澎湃的力量，激動得幾乎說不出話來。",
    "看向曹星的目光中，也充滿了感激！",
    "因你幫助其提升實力，領地成員：賽琳娜·卡莎忠誠度已大幅度提升，當前忠誠度：87",
    "因你幫助其提升實力，領地成員：埃爾德林·青葉忠誠度已大幅度提升，當前忠誠度：85",
    "望著這兩條系統提示，曹星臉上沒有什么變化。",
    "之所以讓卡莎女王和神木老者接受賜福，也是經過他考慮的。",
    "雖然這二人加入領地的時間沒多久，也不知道他們的人品如何。",
    "但曹星知道，要想讓這些家伙提升忠誠度，總歸要給一點甜頭。",
    "就比如自己的一系列賜福。",
    "目前看來，效果倒是相當顯著。",
    "當然，曹星也只是簡單的為他們施加了一些狀態技能，比其他人的少多了。",
    "而且最關鍵的勇氣祝福和力量祝福等狀態，都還捏在柳慕雪手里。",
    "但即使如此，也足夠神木老者和卡莎女王感恩戴德了。",
    "從他們此刻的表情就能看出來，對于這種體內多出的神奇力量，感到十分滿意。",
    "與此同時，在所有擁有狀態技能的成員們全部釋放完畢后。",
    "曹星隨手一揮，將那團光圈撤去，“好了，賜福已經結束，你們都可以自由活動了。”",
    "“這一次，我領地中絕大部分賜福基本上已經給你們附加上了。”",
    "“雖然還有幾個更強大的賜福，但因為她不太方便，所以只能等下次再說。”",
    "直到曹星的聲音響起，那群冰原巨人們才回過神來。",
    "他們迅速站穩身子，低頭注視著自己的身體。",
    "一個個瞪大了眼睛，難以置信的感受著自己煥然一新的身體，還有體內澎湃的力量！",
    "“這就是這位人類領主所說的賜福之力嗎？太神奇了！”",
    "“先祖在上，我感覺自己甚至擁有了不死之軀！”",
    "“不可思議！現在的我，甚至敢單挑三個傳奇級冰巢怪，不，四個！”",
    "“這……這簡直是超越了神靈的力量！”"
  ],
  "updatedAt": "2026-06-25T04:03:59.000Z"
}